"This often includes embalming and burial or cremation of the dead , as well as the planning and arrangement of the actual funeral ceremony .","These tasks often entail the embalming and burial or cremation of the dead , as well as the planning and arrangement of the actual funeral ceremony ."
"In 1826 , at the age of 27 , she managed to save enough money to buy a home with a glass store front window for her shop , called `` Anning 's Fossil Depot '' .","In 1826 , at the age of 27 , Anning managed to save enough money to purchase a home with a glass store-front window for her shop , `` Anning 's Fossil Depot '' ."
The term `` security clearance '' is also sometimes used in private organizations that have a formal process of selecting employees to access `` sensitive information '' .,The term `` security clearance '' is also sometimes used in private organizations that have a formal process to vet employees for access to sensitive information .
"It became a city on May 15 , 1906 , after previously being named North Ontario and a part of Ontario .","It was incorporated on May 15 , 1906 , after previously being named North Ontario ."
"In 1933 he started his own business , a `` literary agency '' , in Manhattan , New York .","In 1933 , he established a literary agency in Manhattan , New York ."
She was the daughter of a rich man who had a business making sewing machines .,She was the daughter of a well-known manufacturer of yarn for sewing machines .
"Though the storm was forecasted to remain far away from the Gulf of Mexico , investors tracking the storm caused the price of crude oil to rise 60 cents a barrel due to the possible impact to oil installations .","Though the storm was forecast to remain far away from the Gulf of Mexico , investors tracking the storm caused the price of crude oil to rise 60 cents a barrel due to the potential impact to oil installations ."
"These controversies have led to litigation , international trade disputes , and protests , and to restrictive regulation of commercial products in most countries .","These controversies have led to litigation , international trade disputes , and protests , and to restrictive regulation of commercial products in some countries ."
American Eagle is a clothing store in the United States and Canada .,American Eagle is also opening stores in Mexico .
"It was headquartered in Eagan , Minnesota , near Minneapolis-St. Paul International Airport in the United States .","Northwest was headquartered in Eagan , Minnesota near Minneapolis-St. Paul International Airport ."
"John Davison Rockefeller ( July 8 , 1839 – May 23 , 1937 ) was an American businessman .","John Davison Rockefeller Sr. ( July 8 , 1839 – May 23 , 1937 ) was an American industrialist and philanthropist ."
"Today , boutique may refer to a specialised firm , such as a boutique investment bank or boutique law firm .","This term can also refer to a specialized firm in other industries , such as a boutique investment bank or boutique law firm ."
Along with the expansion of stores and the expanded menu came the outsourcing of baked goods .,Coupled with the expansion and expanded menu came the outsourcing of baked goods .
"This all happened during the middle of the great depression , so they moved to Nashville , Tennessee to see if they could get better business there and secure their financial future .","This all occurred during the middle of the Great Depression , so they moved to Nashville , Tennessee to see if they could get better business there and secure their financial future ."
Classified advertising at some of the larger newspaper chains has dropped 14 % to 20 % in 2007 while traffic to classified sites has grown 23 % .,"Classified advertising at some of the larger newspaper chains dropped by 14 % to 20 % in 2007 , while traffic to classified sites grew by 23 % ."
D. G. Yuengling & Son is the oldest operating brewing company in the United States .,"D. G. Yuengling & Son is the oldest operating brewing company in the United States , established in 1829 ."
The Ripley area has been industrialized since the late 18th century .,The Ripley area has been industrialised since the late 18th century .
"The Institute of Certified Management Accountants ( ICMA ) , states `` A management accountant applies his or her professional knowledge and skill in the preparation and presentation of financial and other decision oriented information in such a way as to assist management in the formulation of policies and in the planning and control of the operation of the undertaking '' .",The Institute of Certified Management Accountants ( CMA ) .states `` A management accountant applies his or her professional knowledge and skill in the preparation and presentation of financial and other decision oriented information in such a way as to assist management in the formulation of policies and in the planning and control of the operation of the undertaking '' .
The author was acutely aware of the quality of the novel and publication of the work went to the highest bidder .,Hugo was acutely aware of the quality of the novel and publication of the work went to the highest bidder .
"Formed in 1911 as The Motor Rail & Tramcar Co Ltd , they built petrol and diesel engined locomotives , mainly narrow gauge .","Formed in 1911 as The Motor Rail & Tramcar Co Ltd , the company built petrol and diesel-engined locomotives , mainly for narrow gauge railways ."
"In 1987 , Gillard joined the law firm Slater & Gordon at Werribee , Melbourne , working in industrial law .","In 1987 , Gillard joined the law firm Slater & Gordon in Werribee , Victoria , working in industrial law ."
"When Early begins heading to his interview , he is stopped and confronted by his landlord for not paying his rent .","However , when he is on his way out , he is confronted by his landlord over non-payment of rent ."
"In the 1980s , book publisher Harcourt , Brace , Jovanovich bought the park along with SeaWorld , Circus World ( later rebuilt as Boardwalk & Baseball ) and Stars Hall of Fame , but sold most of the businesses to Anheuser-Busch in 1989 .",Harcourt sold most of the businesses to Anheuser-Busch in 1989 .
"Hence , this one energy drink has helped create a market for over 150 related types of merchandise , like Red Rooster and Blue Lightning .",The energy drink has created a market for over 150 related types of merchandise .
Hot chocolate and churros is the normal working-man 's breakfast in Spain .,Hot chocolate with churros is the traditional working-man 's breakfast in Spain .
"He took the position on 31 October 2009 , Before he was Chief Operating Officer of the club .","Before taking the role , he was Chief Operating Officer of the club ."
"The Essex town of Saffron Walden , named for its new specialty crop , became England 's main saffron growing and trading center .","The Essex town of Saffron Walden , named for its new speciality crop , emerged as a prime saffron growing and trading centre ."
"Sprint Nextel Corporation ( ) is a telecommunications company based in Overland Park , Kansas .","The company is headquartered in Overland Park , Kansas ."
"In December 2006 , she married her long time business manager and friend , Paul Truong .","In December 2006 , she married her longtime business manager and friend , Paul Truong ."
"In 2002 , Moby started a cafe called Teany with his ex-girlfriend Kelly Tisdale .",Teany was cofounded in 2002 with his ex-girlfriend Kelly Tisdale .
"However , it was not enough to save the Laemmles , who were unceremoniously removed from the company they had founded .",They were unceremoniously removed from the company they had founded .
In 1873 mine owners tried to bring in Saturday afternoon and Sunday work .,In 1873 mine employers attempted to introduce Saturday afternoon and Sunday shifts .
"Enercon has a share in the project and will build a wind tower production plant in the region , as well as a local office for service and maintenance .","Svevind owns 75 % of the project ; Enercon has a 25 % share and will build a wind tower production plant in the region , as well as a local office for service and maintenance ."
Quaker Oats was founded in 1901 as the four oat mills merged :,Quaker Oats was founded in 1901 by the merger of four oat mills :
"Molotov cocktails were eventually mass-produced by the Finnish military , bundled with matches to light them .","Molotov cocktails were eventually mass-produced by the Alko corporation at its Rajamäki distillery , bundled with matches to light them ."
"In comparison with its Xeon server processors , Itanium has never been a large product for Intel .","In comparison with its Xeon family of server processors , Itanium has never been a high-volume product for Intel ."
"In 1891 , Chongqing became the first inland commerce port open to foreigners .","The following year , the city became the first inland commerce port open to foreigners ."
"Most of the cartful can be found near the public housings , schools and MTR stations , because a steady stream of people from these places can help increase their business turnover .","Most of the cartfuls can be found near the public housings , schools and MTR stations , because a steady stream of people in these places helps increase their business turnover ."
Karachi South District ( ) is in the Karachi Division of the Sindh province of Pakistan .,Karachi South District is the economic backbone of the country .
"Palm oil production is clearing lots of forest , reducing the habitat of the Siamang , along with that of other species such as the Sumatran Tiger .","The palm oil production industry is clearing large swaths of forest , reducing the habitat of the siamang , along with that of other species , such as the Sumatran tiger ."
"Since retiring , Reeves moved back to Gans , Oklahoma where he owns a large cattle ranch just outside of Gans and lives with his wife and three children .","Reeves owns a large cattle ranch outside Gans , where he lives with his wife and three children ."
"In 2011 , the restaurant was ranked at # 10 on QSR Magazine’s rankings of the top 50 quick-service and fast-casual restaurant brands in the nation .","In 2011 , it was ranked 10th in `` QSR Magazine '' rankings of the top 50 quick-service and fast-casual restaurant brands in the nation ."
These 737-400 aircraft are now being used .,These 737-400 Combi aircraft are now in service .
Compare The Market is the show 's sponsor .,Compare The Market were named as the new sponsor .
"In 2008 , the City of London accounted for 4 % of UK GDP .","In 2009 , the City of London accounted for 2.4 % of UK GDP ."
Besham 's shops are open 24 hours a day due to its location on the famous Silk route which connects Pakistan with China .,"Besham 's shops remained open 24 hours a day due to its geographic position , as it is on the famous Silk route which connects Pakistan with China ."
He played Henry Ford in the 1987 `` Ford : The Man and the Machine '' .,"In 1987 , he portrayed Henry Ford in `` Ford : The Man and The Machine '' ."
New Providence is the main commercial hub of The Bahamas .,New Providence functions as the main commercial hub of the Bahamas .
"First Greater Manchester ( formerly First Manchester ) is one of the bus companies serving Greater Manchester , a metropolitan county in North West England .","First Greater Manchester , is a bus operator in Greater Manchester ."
"Tim Chaney , the former Managing Director was named as President .","Tim Chaney , the former Managing Director was named president ."
"Cyrus Hall McCormick , Sr. ( February 15 , 1809 – May 13 , 1884 ) was an American inventor and founder of the McCormick Harvesting Machine Company , which became part of International Harvester Company in 1902 .","Cyrus Hall McCormick ( February 15 , 1809 – May 13 , 1884 ) was an American inventor and founder of the McCormick Harvesting Machine Company , which became part of International Harvester Company in 1902 ."
"Some items are also seen as being treated `` as if '' they were commodities , e.g .","These priced goods are also treated as commodities , e.g ."
"The second single was `` Get Buck '' , produced by Polow Da Don .","The album 's second single is `` Get Buck '' , produced by Polow da Don ."
"According to the article , Wojtowicz , along with Sal Naturile , held up a Chase Manhattan Bank branch in Brooklyn , New York on August 22 , 1972 .","Wojtowicz , along with Sal Naturale , held up a Chase Manhattan Bank branch in Brooklyn , New York on August 22 , 1972 ."
"Cole essentially blamed Microsoft , `` This is related to XP SP3 , '' he stated .",Cole blamed Microsoft `` This is related to XP SP3 . ''
"On August 22 , 2011 , it was said that Delta Air Lines ordered 100 737-900ERs .","On August 22 , 2011 , it was reported that Delta Air Lines placed an order for 100 737-900ERs ."
"Watt did most of his work at his home in Harper’s Hill in Birmingham , while Boulton worked at the Soho Manufactory .","Watt did most of his work at his home in Harper 's Hill in Birmingham , while Boulton worked at the Soho Manufactory ."
"However , readers often like an up/down listing of data , down each column. < br > A border can be added with style= '' border:1px solid # BBB '' :","However , readers often prefer a vertical listing of data , down each column. < br > A border can be added with style= '' border:1px solid # BBB '' :"
"It constructed a network of high pressure mains on both sides of the Thames which , ultimately , extended to 184 miles and powered some 8,000 machines , predominantly lifts ( elevators ) and cranes .","It constructed a network of high-pressure mains on both sides of the Thames which , ultimately , extended to 184 miles and powered some 8,000 machines , predominantly elevators ( lifts ) and cranes ."
"The company used Russian Donskio wool , which was widely used in the woollens trade , but not in worsted cloth .","The company used Russian `` Donskoi '' wool , which was widely used in the woollens trade , but not in worsted cloth ."
"He rose to head of department in 1987 , with responsibility for financial policy and federal industrial interests .",He rose to Director General for financial policy and federal industrial interests in 1987 .
"Very large corporations such as GE , Toyota and Sharp , and investment firms such as Goldman Sachs are spending billions of dollars on clean technology .","Very large corporations such as GE , Toyota and Sharp , and investment firms such as Goldman Sachs are making multibillion-dollar investments in clean technology ."
"In December 1994 , the two boutiques began to suffer .","In December 1994 , the boutiques began to suffer ."
"Ozark is part of the Springfield , Missouri metropolitan area , and is centered along a business loop of U.S. Route 65 , where it crosses Missouri Route 14 .","Ozark is part of the Springfield , Missouri Metropolitan Area , and is centered along a business loop of U.S. Route 65 , where it intersects with Missouri Route 14 ."
"The town has great telecommunication facilities , an average-rated water supply system , fire station , several post offices and a police station .","The town has excellent telecommunication facilities , an average-rated water supply system , fire station , several post offices and a police station ."
"Co-ops smaller amounts of food to sell , and coop managers were often drafted , whereas business opponents were able to have even clerks declared vital for the war effort .","Co-operatives received minimal supplies and even management were often drafted , whereas business opponents were able to have even clerks declared vital for the war effort ."
"However , it is now being used on lawns and in commercial applications as well .","However , it is now being used on residential lawns and commercial applications as well ."
"In November 2004 , 80 percent of Dollarama was sold to a private equity fund , Bain Capital , of Boston , Massachusetts for $ 850 million US .","In November 2004 , 80 percent of the chain was sold for $ 850 million US , to a private equity fund , Bain Capital , of Boston , Massachusetts ."
It is mainly used for freight operation but also serves more than 21 destinations for passengers ( mainly charters ) .,"It is mainly used for freight/cargo operations , but also serves more than 23 destinations for passengers ( mainly charters ) ."
"Aviacsa stopped all operations for good on May 4 , 2011 .","Aviacsa ceased operations on May 4 , 2011 ."
The school delivers 14 Master of Business Administration ( MBA ) recognized by French State and can teach both technical and management aspects .,The school delivers 14 MBA recognized by French State and has the particularity to teach both technical and management aspects .
The modern organization was created in 1970 .,The modern organisation was created in 1970 .
"In Belgium , Merrick was robbed by his manager and left in Brussels alone .","In Belgium , Merrick was robbed by his road manager and abandoned in Brussels ."
"These books include `` Winning the Oil Endgame '' , `` Small is Profitable '' , `` Factor Four '' , and `` Natural Capitalism '' .","These books include `` Reinventing Fire '' , `` Winning the Oil Endgame '' , `` Small is Profitable '' , `` Brittle Power '' , and `` Natural Capitalism '' ."
"The conferences subjects were web strategy , social media , onsite behavioral targeting , competitive intelligence , web analytics , multivariate testing and all aspects of eMarketing ( search marketing , affiliate marketing etc . )","The conference has tackled the subjects of web strategy , social media , onsite behavioral targeting , competitive intelligence , web analytics , multivariate testing and all aspects of eMarketing ( search marketing , affiliate marketing etc . )"
24 Hour endurance races also hosted at BIC .,24 Hour endurance races are also hosted at BIC .
Fenininger also worked as a commercial caricaturist for 20 years for various newspapers and magazines in both the USA and Germany .,He also worked as a commercial caricaturist for 20 years for various newspapers and magazines in both the USA and Germany .
"In 2007 , Hy-Vee ranked 47th on `` Forbes '' magazine 's annual list of the largest privately owned companies in the United States .",Hy-Vee ranked 40th on `` Forbes '' magazine 's annual list of the largest privately owned companies in the United States in 2015. < br >
"At the time of his death , he was a Senior Partner at O'Melveny & Myers in the firm 's Century City , California , office .",He was a Senior Partner at O'Melveny & Myers .
Community relations managers work closely with local schools and groups for the promotion of literacy and the arts .,Community business development managers also work closely with local schools and groups to promote literacy and the arts .
"Bowers Coaches was a bus operator based in Chapel-en-le-Frith , Derbyshire .","Bowers Coaches was a bus company based in Chapel-en-le-Frith , Derbyshire , England ."
"The Kansas Turnpike is owned and repaired by the Kansas Turnpike Authority ( KTA ) , which is based in Wichita .","The turnpike is owned and maintained by the Kansas Turnpike Authority ( KTA ) , which is headquartered in Wichita ."
"William Randolph Cosentini ( June 12 , 1911 - January 28 , 1954 ) was an American mechanical engineer and businessman .","William Randolph Cosentini ( June 12 , 1911 – January 28 , 1954 ) was an American mechanical engineer and entrepreneur who founded Cosentini Associates ."
The four letters in the middle of the logo stand for the initials of Anthony Colin Bruce Chapman .,"The four letters in the middle of the logo stand for the initials of company founder , Anthony Colin Bruce Chapman ."
It also has offices and regional examination centres in most other European countries .,It also has offices and regional examination centres in many other European countries .
"On January 4 , 2009 , Relativity Media acquired the genre label Rogue Pictures from Universal , for a $ 150 million .","On January 4 , 2009 , the studio acquired the genre label Rogue from Universal , for $ 150 million ."
"Qantas began in Winton , Queensland on 16 November 1920 as `` Queensland and Northern Territorial Aerial Service Limited '' .","Qantas was founded in Winton , Queensland on 16 November 1920 as Queensland and Northern Territory Aerial Services Limited ."
The crew of the Indomitable are working on deck .,The crew of the Indomitable works on deck .
"Sean , Liadan 's brother and heir to Sevenwaters , wants to buy the Painted Man 's fighting men in their long battle for the sacred islands .","Sean , Liadan 's brother and heir to Sevenwaters , wants to purchase the Painted Man 's fighting force in their long battle for the sacred islands ."
"Satya Narayana Nadella ( ; born August 19 , 1967 ) is an Indian-American businessman .","Satya Narayana Nadella ( born August 19 , 1967 ) is an India-born American business executive ."
He is known for being the founder of Food Lion ( founded as Food Town ) .,He is known for being the founder of Food Lion ( originally founded as Food Town ) .
"Many guests have been helping with hosting this event , including Danny Sullivan ( Search Engine Watch ) , Jeffrey Eisenberg ( Future Now , Inc. ) , Jim Wilson ( Jim World ) , Lucas Morea ( LatinEdge ) , Mitch Joel ( Twist Image ) , Scott Ferber ( Advertising.com ) , Stephen Turner ( ClickTracks ) , Matthew Colebourne ( coComment ) , Brian Clifton ( Google ) .","Speakers have included Danny Sullivan ( Search Engine Watch ) , Jeffrey Eisenberg ( Future Now , Inc. ) , Jim Wilson ( Jim World ) , Lucas Morea ( LatinEdge ) , Mitch Joel ( Twist Image ) , Scott Ferber ( Advertising.com ) , Stephen Turner ( ClickTracks ) , Matthew Colebourne ( coComment ) , Brian Clifton ( Google ) ."
"The Glasgow and South Western Railway also set up their works here , producing nearly 400 locomotives by the time it was absorbed by the London , Midland and Scottish Railway in 1923 .","The Glasgow and South Western Railway set up their works here , producing nearly 400 locomotives by the time it was absorbed by the London , Midland and Scottish Railway in 1923 ."
The builder was James Wallace of 123 Sussex St Sydney .,"The builder was James Wallace of 123 Sussex Street , Sydney ."
"Northrup 's company designed , patented , developed and manufactured some of the first commercial solar water heaters , solar concentrators , solar-powered air conditioning systems , solar power towers and photovoltaic thermal hybrid systems in the United States .","Influenced by the work of Professor John Yellott , Dr. Maria Telkes , and Harry Tabor , Northrup 's company designed , patented , developed and manufactured some of the first commercial solar water heaters , solar concentrators , solar-powered air conditioning systems , solar power towers and photovoltaic thermal hybrid systems in the United States ."
"Then , after each laundry load , the starch can be used again .","After each laundering , the starch would be reapplied ."
"Nigeria has become Africa 's biggest producer of petroleum , and there are many oil wells in the Niger Delta .",Nigeria has become West Africa 's biggest producer of petroleum .
"For this , it applies both technical and human-centered disciplines such as control engineering , industrial engineering , organizational studies , and project management .","It overlaps technical and human-centered disciplines such as industrial engineering , control engineering , software engineering , organizational studies , and project management ."
"The Caledonian Sleeper are transferred to ScotRail , now First ScotRail .","The Caledonian Sleeper service was transferred to ScotRail , then First ScotRail and now Serco ."
"The total number of large industrial organisations is 319 , compared to 733 small industrial organisations .","The total number of large industrial organizations is 319 , compared to 733 small industrial organizations ."
"The idea of using a heterojunction is as old as the conventional BJT , dating back to a patent from 1951 .","The idea of employing a heterojunction is as old as the conventional BJT , dating back to a patent from 1951 ."
"These air charter companies have a lot of different types of aircrafts , such as helicopters and business jets .","Some air charter companies offer a large variety of aircraft , such as helicopters and business jets ."
"The statute applies to employees engaged in interstate commerce or employed by a business engaged in commerce or in the production of goods for commerce , unless the employer can claim an from these requirements .","It applies to employees engaged in interstate commerce or employed by an enterprise engaged in commerce or in the production of goods for commerce , unless the employer can claim an exemption from coverage ."
Madison County produced most cotton in Alabama during this time .,Madison County led Alabama in cotton production during this time .
"Clients selected a design , specified colours and fabrics , and had a version tailor-made in Worth 's workshop .","Clients selected one model , specified colors and fabrics , and had a duplicate garment tailor-made in Worth 's workshop ."
"Robert Warne Wilson ( November 3 , 1926 – December 23 , 2013 ) was an American hedge fund manager and philanthropist .","Robert Warne Wilson ( November 3 , 1926 – December 23 , 2013 ) was an American hedge fund manager , philanthropist and art collector ."
"The song was recorded in three takes on July 2 , 1969 , before the Beatles started work on `` Golden Slumbers '' / '' Carry That Weight '' .","The song was recorded in three takes on 2 July 1969 , prior to the Beatles beginning work on `` Golden Slumbers/Carry That Weight '' ."
