"The usage of telecommuting by major corporations is a significant opportunity to conserve energy , as many Americans now work in service jobs that enable them to work from home instead of commuting to work each day .","The use of telecommuting by major corporations is a significant opportunity to conserve energy , as many Americans now work in service jobs that enable them to work from home instead of commuting to work each day ."
Those who advocate these measures are concerned with the later phases of product lifecycle and the comprehensive outcome of the whole production process .,Those who advocate it are concerned with the later phases of product lifecycle and the comprehensive outcome of the whole production process .
"Thomas Daniel `` Tommy '' Mottola ( born July 14 , 1949 ) is an American music executive , co-owner of Casablanca Records in a joint venture with the Universal Music Group .",He is the co-owner of Casablanca Records in a joint venture with the Universal Music Group .
"Sales for 2002 were about $ 62 million , and those for 2003 were $ 99 million .","Sales for 2002 were about US $ 62 million , and those for 2003 were US $ 99 million ."
"In the north of the province , most industry is concentrated in and around the cities of Bruges and Ostend .","In the north of the province , most industry is concentrated in and around the cities of Bruges and Oostende ."
Jean Henri Dunant was a Swiss businessman and social activist .,Dunant was a Swiss businessman and social activist .
Chaleo and Dietrich each held a 49 % share of the new company .,Yoovidhya and Mateschitz each held a 49 percent share of the new company .
"They have loading docks to load and unload trucks ; or sometimes are loaded directly from railways , airports , or seaports .",They usually have loading docks to load and unload goods from trucks .
"This had followed another long association with local car dealer Ian Skelly , who had sponsored the club since 1984 .","This had in turn followed another long-term association with local car dealer Ian Skelly , who had sponsored the club since 1984 ."
"In 1995 , she received a Masters of European Business from Solvay Brussels School of Economics and Management in Brussels , Belgium and in 2000 , she graduated with a M.B.A. from Harvard Business School .","In 1995 , she received a Masters of European Business degree from Solvay Brussels School of Economics and Management in Brussels , Belgium ."
"Fearing that Daggett , Bane 's employer , would gain access to the reactor , Bruce and Lucius Fox asks board member Miranda Tate to take over his company .","Fearing that Daggett , Bane 's employer , would gain access to the reactor , Bruce asks Wayne Enterprises board member Miranda Tate ( Marion Cotillard ) to take over his company ."
"The divisions are Boeing Commercial Airplanes ( BCA ) ; Boeing Defense , Space & Security ( BDS ) ; Engineering , Operations & Technology ; Boeing Capital ; and Boeing Shared Services Group .","The two largest divisions are Boeing Commercial Airplanes and Boeing Defense , Space & Security ( BDS ) ."
The contest was done by two companies : Antena 3 and Cope .,The contest was conducted by companies Antena 3 and Cope .
This firm had previously been in the business of taking slaves to North America .,This firm had previously been involved in transporting slaves to North America .
The World Bank Group gives loans at low rate of interest to member countries .,The World Bank Group consists of
"While traditional MNCs are national companies with foreign subsidiaries , TNCs spread out their operations in many countries sustaining high levels of local responsiveness. < ref name= '' Case study : The Relationship between the Structure/Strategy of Multinational Corporations and Patterns of Knowledge Sharing within them '' > < /ref > An example of a TNC is Nestlé who employ senior executives from many countries and try to make decisions from a global perspective rather than from one centralized headquarters .",An example of a transnational corporation is Nestlé who employ senior executives from many countries and try to make decisions from a global perspective rather than from one centralized headquarters .
"The United States Secretary of Commerce is the head of the United States Department of Commerce concerned with business and industry ; the Department states its mission to be `` to foster , promote , and develop the foreign and domestic commerce . ''","A member of the President 's Cabinet , the Secretary is concerned with promoting American businesses and industries ; the Department states its mission to be `` to foster , promote , and develop the foreign and domestic commerce '' ."
"Dover Air Force Base is inside the southeast corporate limits of Dover , however the closest sizable civilian airport to Dover is the New Castle Airport in New Castle .",Dover Air Force Base is located within the southeast corporate limits of Dover .
"In January 2013 , the countries with the most LinkedIn users were :",The countries with the most LinkedIn users were :
"Men at Work is an Australian reggae-influenced rock band that formed in 1979 in St. Kilda , a suburb of Melbourne .","Men at Work were an Australian rock band , which formed in 1978 ."
"His partners , Kevin Roche and John Dinkeloo , completed his ten remaining projects , including the St. Louis Arch .","His partners , Kevin Roche and John Dinkeloo , completed his 10 remaining projects , including the St. Louis Arch ."
"In practice it is the locomotive which decides where trains may operate , although many high capacity four axle wagons have high RAs when fully loaded .","In practice it is the locomotive which governs where trains may operate , although many high capacity 4 axle wagons have high RAs when fully loaded ."
"During the 1930s , industry decreased in Huntsville because of the Great Depression .","During the 1930s , industry declined in Huntsville due to the Great Depression ."
The project cost about AU $ 200 million .,The project cost approximately A $ 200 million .
"Mark Robert Michael Wahlberg ( born June 5 , 1971 ) is an American actor and television and movie producer .","Mark Robert Michael Wahlberg ( born June 5 , 1971 ) is an American actor , producer , businessman , and former model and rapper ."
In 1883 a new Peechelba office opened which closed in 1889 .,"In 1890 Peechelba Town office opened , closing in 1969 ."
"In 1602 , the Dutch East India Company issued shares that were made tradable on the Amsterdam Stock Exchange .","Soon afterwards , in 1602 , the Dutch East India Company issued shares that were made tradable on the Amsterdam Stock Exchange ."
"Bacon was often in trouble for spending too much , and in 1601 he was arrested for debt .",In 1598 Bacon was arrested for debt .
This publication deals with virtually every facet of publishing and nearly all tools available as at the time of the publishing of this book in the year 2000 .,This publication deals with virtually every facet of publishing and nearly all tools available at the time ( 2000 ) .
All of the schools and most businesses closed .,"All of the schools closed , and most businesses shuttered ."
"As a specialist in employment and training , he performed several missions in West Africa .","Employment and training specialist , he undertook several missions in West Africa ."
"He told them `` he who shall not work , shall not eat . ''","He publicly stated `` He that will not work , shall not eat '' ."
A Steel mill or steelworks is an industrial plant where steel is manufactured .,A steel mill or steelworks is an industrial plant for the manufacture of steel .
King formed his own band ; the B.B .,King assembled his own band ; the B.B .
RBI also exercises a system of capital controls in addition to the intervention ( through active trading ) in the currency markets .,RBI also exercises a system of capital controls in addition to intervention ( through active trading ) in currency markets .
"Bottrop is in the Ruhr industrial area , It is next to Essen , Oberhausen , Gladbeck and Dorsten .","Located in the Ruhr industrial area , Bottrop adjoins Essen , Oberhausen , Gladbeck and Dorsten ."
He also founded the independent country music record label BNA Records which he later sold to BMG Music .,Castleman founded the independent country music record label BNA Records which he later sold to BMG Music .
Dr. Richard Malouf started All Smiles in 2002 .,Dr. Richard Malouf founded the chain .
The church is in a residential neighborhood on the west side of Topeka about three miles ( 5 km ) west of the Kansas State Capitol .,It is headquartered in a residential neighborhood on the west side of Topeka about west of the Kansas State Capitol .
"On August 15 , 2011 , Google said that it would buy Motorola Mobility for $ 12.5 billion .","On October 30 , 2014 , Google sold off Motorola Mobility to Lenovo ."
"In 1954 , Hudson merged with the Nash-Kelvinator Company , to form American Motors Corporation .","On May 1 , 1954 , Hudson merged with Nash-Kelvinator Corporation to become American Motors ."
"Commercial fishing , once a mainstay of the state 's economy , maintains a presence , mostly lobstering and groundfishing .","Commercial fishing , once a mainstay of the state 's economy , maintains a presence , particularly lobstering and groundfishing ."
The products of the company are sold in about 125 countries .,Their products are sold in approximately 125 countries .
The band was originally signed to Wild Rags but left because the label did not pay them as much as they promised .,The band 's vocalist later stated the label did not pay them as much as promised .
"bands in the early days of the genre included Angelic Upstarts , The 4-Skins , The Business , Blitz , The Blood , and Combat 84 .","in the early days of the genre included Angelic Upstarts , The 4-Skins , The Business , Anti-Establishment , Blitz , The Blood , and Combat 84 ."
Phelps kept the mines until 1948 when the copper had all been taken out .,Phelps retained the mines until 1948 when they were exhausted .
"In addition to its permanent galleries of historical portraits , the National Portrait Gallery exhibits a rapidly changing collection of contemporary work , stages exhibitions of portrait art by individual artists and hosts the annual BP Portrait Prize competition .","In addition to its permanent galleries of historical portraits , the National Portrait Gallery exhibits a rapidly changing selection of contemporary work , stages exhibitions of portrait art by individual artists and hosts the annual BP Portrait Prize competition ."
"One of the early , and most well known , examples of the work of the company includes the graceful arched roof of St. Pancras Station in London , recently restored as an international rail terminal .","One of the early , and most well-known , examples of the work of the company includes the arched roof of St. Pancras Station in London , recently restored as an international rail terminal ."
"1100 New York Avenue is a high-rise office building in Northwest , Washington , D.C. in the United States .","1100 New York Avenue is a high-rise office building located in Northwest , Washington , D.C. in the United States ."
"In general , a company is same as a corporation .","In the US , a company is not necessarily a corporation ."
"In 1996 , the Woman 's Board published a fact sheet on the workplace effects of domestic violence .","In 1996 , the WB published a fact sheet on the workplace effects of domestic violence ."
UOL soon became the leader in the Brazilian internet market .,The company soon became the leader in the Brazilian internet market .
"William Foster went to work for the company Denny and Bellen , `` Dry Goods , Hardware , etc . ''","William Foster found work with the company of Denny and Bellen , `` Dry Goods , Hardware , etc . ''"
"With 27.7 % of the daily crude oil production stopped because of the depression , oil prices rose higher after days of increasing levels , and on September 20 reached a record rate of over $ 84 per barrel .","With 27.7 % of the daily crude oil production halted due to the depression , oil prices rose further after days of increasing levels , and on September 20 reached a record rate of over $ 84 per barrel ."
This system of trading was used mostly in ancient Ghana .,This system of trading was used in particular in ancient Ghana .
Diller was married to Sherwood Anderson Diller from 1939 until they divorced in 1965 .,Diller was married and divorced twice .
"On 4 October , BAE 's shareholders decided that the sale should go ahead , meaning that Airbus is now completely owned by EADS .","On 4 October shareholders voted in favour of the sale , leaving Airbus entirely owned by EADS ."
"In 1994 , he was the author allowed to interview Gérard Mulliez , one of the wealthiest and powerful people in France , for the book `` The Customer Driven Company — Moving from Talk to Action '' ( translated in French as `` La Dynamique du client '' ) by Richard C. Whiteley .","In 1994 , he was the author allowed to interview Gérard Mulliez , one of the wealthiest and powerful people in France , for the book `` The Customer Driven Company — Moving from Talk to Action '' ( translated in French as `` '' ) by Richard C. Whiteley ."
"Since 2007 , Subway has consistently ranked in entrepreneur magazines ' top 500 Franchise list .","Since 2007 , Subway has consistently ranked in `` Entrepreneur '' magazine 's Top 500 Franchises list ."
Market capitalization represents the public opinion of the value of a company 's equity .,Market cap reflects only the `` equity '' value of a company .
The slow onset of economic recovery got a sudden end by the began of the Seven Years ' War .,The slow onset of economic recovery came to a sudden end with the start of the Seven Years ' War .
"It is set in a small grocery shop in Balby , Doncaster , South Yorkshire .","The setting is a small grocer 's shop in Balby , a suburb of Doncaster in South Yorkshire ."
"More than 4,000 engravers make about 8 million printing cylinders worldwide per year .",8 Mio printing cylinders worldwide per year .
"PLM 's endowment in 2008 was valued at PhP 500 million , excluding the funding allotted for its teaching hospital , Ospital ng Maynila Medical Center , of about PhP 250 million .","PLM 's endowment in 2008 was valued at PhP 500 million , excluding budgetary allocation for its chief teaching hospital , the Ospital ng Maynila Medical Center , which was about PhP 250 million ."
She started her career in the 1940s at the Aho & Soldan company .,"She started her career in the 1940s at the Aho & Soldan company , owned by her family ."
"In 1987 , he joined in the Cabinet as the Minister for Trade and Industry and Second Minister for Defence .","In 1987 , he became a full member of the Cabinet as the minister for trade and Industry and second minister for defence ."
The British Rail Class 35 is a class of mixed traffic B-B diesel locomotive with hydraulic transmission .,The British Rail ( BR ) Class 35 is a class of mixed-traffic B-B diesel locomotive with hydraulic transmission .
"In Japan today , 44 % of mobile phone owners click on ads they get on their phones .","In Japan today , already 44 % of mobile phone owners click on ads they receive on their phones ."
Phillip had a very hard time getting the ships ready for the eight month sea voyage to Australia .,Phillip had a very difficult time assembling the fleet which was to make the eight-month sea voyage to Australia .
The Mozilla project has traditionally been overseen by a committee known as mozilla.org staff ; the individuals on that committee later became foundation or corporation board members or staff members .,The Mozilla project has traditionally been overseen by a committee known as mozilla.org staff ; some individuals on that committee later became Foundation or Corporation board members or employees .
"Since the 1920s , the street 's name has been synonymous with the American advertising industry .","Since the 1920s , the street 's name has been metonymous with the American advertising industry ."
"On February 25 , 2011 , No Fear filed for Chapter 11 bankruptcy .","On February 25 , 2011 , they filed for Chapter 11 bankruptcy ."
Krombacher Brauerei is one of the largest private owned breweries in Germany and the 2nd best selling German beer .,Krombacher Brauerei ( ) is one of the largest privately owned breweries in Germany and ranks number 2 among Germany 's best selling breweries .
"The Chuvash Wikipedia was created on November 22 , 2004 .","It was founded on November 22 , 2004 ."
"Auto-Tune was first created by Andy Hildebrand , an engineer working for Exxon .","Auto-Tune was initially created by Andy Hildebrand , an engineer working for Exxon ."
"It was built in 1925 and processes beet from 1,300 growers .","The refinery processes beet from 1,300 growers ."
The Southern Railway ( SR ) gave the designation 5BEL to the 5-car all-Pullman electric multiple units built to work the prestigious Brighton Belle trains between London Victoria and Brighton .,The Southern Railway ( SR ) gave the designation 5-BEL to the five-car all-Pullman electric multiple units which worked the prestigious Brighton Belle trains between London Victoria and Brighton .
The Delaware Department of Transportation is responsible for taking care of the numbered roads in Delaware .,The Delaware Department of Transportation is responsible for maintaining numbered roads in Delaware .
Before he was Minister of the Economy from 2009 to 2011 .,He was previously Minister of the Economy from 2009 to 2011 .
"Starting as a Collector of Customs for the Gold Coast , he later became the Treasurer of the Gold Coast and The Gambia .","Starting as a Collector of Customs for the Gold Coast , he then became a Treasurer of the Gold Coast and the Gambia ."
"In 1980 , Ben and Jerry got space in a building in South Champlain Street in Burlington and started packing their ice cream in pint containers .","In 1980 , they rented space in an old spool and bobbin mill on South Champlain Street in Burlington and started packing their ice cream in pints ."
The L & B used only coal-fired steam engines .,The L & B used only coal-fired steam motive power .
"The Maryland in Liberia colony remained apart , as the state colonization society did not want anyone else to be able to trade goods .","The Maryland colony remained apart , as the state colonization society wished to maintain its trade monopoly in the area ."
"Varney joined Fox News Channel in January , 2004 as a business contributor on other shows including `` Your World with Neil Cavuto '' .","Varney joined Fox News in January 2004 as a business contributor on many shows , such as `` Your World with Neil Cavuto '' ."
"Ramsay 's flagship restaurant , the `` Restaurant Gordon Ramsay '' in Chelsea , has three Michelin stars , and has had them since 2001 .","His signature restaurant , Restaurant Gordon Ramsay in Chelsea , London , has held 3 Michelin stars since 2001 ."
The Board had seven members and a staff .,The Board had seven members and a large staff .
It is one of the world 's biggest economic sectors in terms of the money it makes .,It is one of the world 's most important economic sectors by revenue .
Large modern water turbines operate at mechanical efficiencies greater than 90 % ( not to be confused with thermodynamic efficiency ) .,Large modern water turbines operate at mechanical efficiencies greater than 90 % .
"In 2001 the Bank of Scotland merged with Halifax to make HBOS ( Halifax Bank of Scotland ) , this then merged with Lloyds TSB in 2009 .","In 1955 , the Bank merged with the Union Bank of Scotland ."
The District is working with the Rappaport Cos. and the William S. Smith Cos. on a new plan for Skyland .,The District is working with the Rappaport Cos. and the William S. Smith Cos. on a master plan for the site .
Then he went on with a study in business administration at the University of Washington .,He later studied business administration at the University of Washington .
"The mill was built in 1861 , and purchased by brothers Charles and Frederick Schwamb in 1864 for the manufacture of picture frames .",The mill was purchased by brothers Charles and Frederick Schwamb in 1864 for the manufacture of circular and elliptical picture frames .
"Enterprise server makers differentiate their systems by making their own chipsets that interface the processor to memory , interconnections , and peripheral controllers .","Enterprise server manufacturers differentiate their systems by designing and developing chipsets that interface the processor to memory , interconnections , and peripheral controllers ."
Southwest Airlines is the airport 's largest carrier in terms of passengers traveled .,Southwest Airlines is the airport 's largest carrier by passengers carried .
"Ruston was an industrial equipment manufacturer in Lincoln , England , the company 's history going back to 1840 .","Ruston & Hornsby , later known as Ruston , was an industrial equipment manufacturer in Lincoln , England , the company 's history going back to 1840 ."
The ascent to an important industrial city came mainly from the nearby Saxony .,The ascent to an important industrial city came mainly from the nearby Kingdom of Saxony .
"At Moa , there is a huge cobalt processing plant with shipping facilities , that was constructed with the help of foreign aid , much of it from Canada .","A large cobalt processing plant with shipping facilities was built at Moa , using foreign investment , much of it from Canada ."
"The original Delmonico 's began in a rented pastry shop at 23 William Street in 1827 , appearing listed as a restaurant in 1830 .","The original Delmonico 's opened in 1827 in a rented pastry shop at 23 William Street , and appeared in a list of restaurants in 1830 ."
"It has a monopoly on the issue of banknotes in England and Wales , and regulates the issue of banknotes by commercial banks in Scotland and Northern Ireland .",The Bank has a monopoly on the issue of banknotes in England and Wales .
"Dresdner Bank attempted to get a banking operating licence in Saint Petersburg , where former KGB agent Vladimir Putin was in charge of foreign economic relations .","Dresdner Bank attempted to get a banking operating license in Saint Petersburg , where former KGB agent Vladimir Putin was in charge of foreign economic relations ."
"Taking on the task of modernizing and upgrading a movie conglomerate in the depths of the depression was risky , and for a time Universal slipped into receivership .","Taking on the task of modernizing and upgrading a film conglomerate in the depths of the depression was risky , and for a time Universal slipped into receivership ."
Concrete is used more than any other man-made material in the world .,Concrete is used more than any other manmade material in the world .
"Ivers made a name for herself by winning money from poker games in places like Silver City , New Mexico , and even working at a saloon that was owned by Bob Ford , the man who killed Jesse James",Ivers made a name for herself by winning money from poker games .
"Thus , the bank 's corporate treasury department will assign funding charges to the business units for their use of the bank 's resources when they make loans to clients .",The treasury department will also assign funding credit to business units who bring in deposits ( resources ) to the bank .
"Although the competition between the `` World '' and the `` Journal '' was fierce , the newspapers had a lot in common .","Although the competition between the `` World '' and the `` Journal '' was fierce , the papers were temperamentally alike ."
Dirty Deeds Done Dirt Cheap is a studio album by the Australian hard rock band AC/DC .,Dirty Deeds Done Dirt Cheap is an album by Australian hard rock band AC/DC .
The basic requirements of the agreements are to be professional and to increase the success of Formula One .,The effect of the agreements is to encourage professionalism and to increase the commercial success of Formula One .
"Finn returns Emmet and the Piece of Resistance to the set where Emmet , now possessing the powers of a Master Builder due to his belief in himself , confronts Lord Business .","Finn returns Emmet and the Piece of Resistance to the set , where Emmet now possesses the powers of a Master Builder and confronts Business ."
"On 19 January 2005 , Ferrari announced that it had signed an extension to the 1997 Concorde Agreement .","On 19 January , Ferrari announced that it had signed an extension to the 1997 Agreement to expire on 31 December 2012 ."
"David Tod , who was later Ohio governor during the Civil War , persuaded Lake Erie steamboat owners that coal from the Mahoning Valley could fuel their vessels if canal transportation were available between Youngstown and Cleveland .","Local industrialist David Tod , who was later Ohio governor during the Civil War , persuaded Lake Erie steamboat owners that coal mined in the Mahoning Valley could fuel their vessels if canal transportation were available between Youngstown and Cleveland ."
This also promotes BookCrossing and creates more members .,This also advertises BookCrossing and creates more members .
"In 1950 , Hoberg changed its name to Charmin Paper Company and kept making toilet paper , paper napkins , and other paper products .","In 1950 , Hoberg changed its name to Charmin Paper Company and continued to produce bath tissue , paper napkins , and other paper products ."
Sauber licensed nearly every part from Ferrari and even had several Ferrari engineers on staff .,Sauber licensed nearly every legally licensable part from Ferrari and even had several Ferrari engineers on staff .
His father is a television weatherman and his mother is a travel agent .,"His mother , Patti Boreanaz , was a travel agent ."
