It also has a weaving mill from 1863 that is thought to be a historical monument .,It also has a weaving mill from 1863 that is considered a historical monument .
The Board does this by using traditional Aboriginal place names or names with Aboriginal origin wherever it can .,The Board does this by preferencing traditional Aboriginal place names or names with Aboriginal origin wherever it can .
"He then worked for two whole years as a helper of a product manager at Home Bargains , where he shared an office with Jeffrey Immelt , who would later become CEO of General Electric .","He then worked as an assistant product manager at Procter & Gamble for two years , where he shared an office with Jeffrey R. Immelt , who later became CEO of General Electric ."
"Before entering political life he was a veterinarian , undertaking a Bachelor 's and then a Master 's Degree in Veterinary Science , both from the University of Melbourne , and later gaining a Master 's Degree in Business Administration , from Deakin University .",He later completed a master 's degree in business administration from Deakin University .
"Janet Yellen ( born August 20 , 1946 ) is an American economist and professor .","Janet Louise Yellen ( born August 13 , 1946 ) is an American economist ."
"As a result , Belmont postponed his departure to Havana and began August Belmont & Company , believing that he could supplant the recently bankrupt firm , the American Agency .","As a result , Belmont postponed his departure for Havana indefinitely and began a new firm , August Belmont & Company , believing that he could supplant the recently bankrupt firm , the American Agency ."
"The Royal Society for the encouragement of Arts , Manufactures and Commerce ( RSA ) is a British multi-disciplinary institution , based in London .","The Society for the encouragement of Arts , Manufactures and Commerce hosted the first `` exhibition of contemporary art '' in 1760 ."
The case entered popular understanding as an example of frivolous litigation,The case is considered by some to be an example of frivolous litigation .
"The Hopkins business school was renamed after William Carey 's great-great-great-grandfather , James Carey .","The Hopkins business school will be named after William Carey 's great-great-great-grandfather , James Carey ."
"The Baku Stock Exchange , BSE ( ) is the main stock exchange of Azerbaijan which is situated in the capital Baku .",The Baku Stock Exchange ( BSE ) ( ) is the main stock exchange in Azerbaijan .
"Sweden is traditionally a protestant country , but it is now one of the least religious countries in the world .",Sweden is the ninth-largest arms exporter in the world .
"In September 1997 , it was announced Versace 's brother , Santo Versace , and Jorge Saud would serve as the new CEOs of Gianni Versace S.P.A. Versace 's sister , Donatella , became the new head of design .","In September 1997 , the media announced that Versace 's brother , Santo , and Jorge Saud would serve as the new CEOs of Gianni Versace S.p.A. Versace 's sister , Donatella , became the new head of design ."
"A business alliance is an agreement between businesses , most of the time to help lower cost and improve service for the customer .","A business alliance is an agreement between businesses , usually motivated by cost reduction and improved service for the customer ."
"The company is in Oberndorf in the state of Baden-Württemberg , but also has locations in the United Kingdom , France and the United States .","The company is located in Oberndorf in the state of Baden-Württemberg , and also has subsidiaries in the United Kingdom , France and the United States ."
"Today , its main economic activities are fishing and tourism .",The main economic activity of the city is fishing and tourism .
"The business was started by Tim Horton , who played in the National Hockey League from 1949 until his death in a car accident in 1974 .","The business was founded by Miles G. '' Tim '' Horton , who played in the National Hockey League from 1949 until his death in a traffic collision in 1974 ."
"This idea originated in the mainframe market where online transaction processing emphasized not just the execution speed of one transaction , but the capacity to deal with big numbers of transactions at the same time .","This idea originated in the mainframe market where online transaction processing emphasized not just the execution speed of one transaction , but the capacity to deal with massive numbers of transactions ."
"Mr. Wilson partnered with Wallace E. Johnson to build the first four motels on roads entering Memphis , Tennessee .",Wilson partnered with Wallace E. Johnson to build additional motels on the roads entering Memphis .
Firestone soon saw the possibility for increasing sales by making tires for automobiles .,Firestone soon saw the huge potential for marketing tires for automobiles .
"Danelectro is a manufacturer of musical instruments and accessories , specializing in guitars , bass guitars , amplifiers and effects units .","Danelectro is a US manufacturer of musical instruments and accessories , specializing in guitars , bass guitars , amplifiers and effects units ."
It is found in the region Rhône-Alpes in the Ain department in the east of France .,Biziat is a commune in the Ain department in eastern France .
In February 2012 Small Smiles asked for Chapter 11 Bankruptcy Protection .,In February 2012 the company filed for Chapter 11 Bankruptcy Protection .
"At the time , the show was criticized for its violent content and commercialism .","At the time , the series was criticised for its commercialism and violent content ."
"In 2009 he filmed for ALmap BBDO the Open Cage campaign for the launch of the EOS convertible , an interactive film mixing 3d techniques with helicopter shots which received Gold at the FIAP and Wave Festival awards .","In 2009 he filmed for Almap BBDO the Open Cage campaign for the launch of the EOS convertible , an interactive film mixing 3D techniques with helicopter shots ."
"The city is also home to the headquarters of U-HAUL International , a rental company and moving supply store , as well Best Western , a hotel chain .","The city is also home to : the headquarters of U-HAUL International ; Best Western ; and Apollo Group , parent of the University of Phoenix ."
"The TeX system , developed by Donald E. Knuth at the end of the 1970s , is another widespread and powerful automated typesetting system which has set high standards , especially for typesetting mathematics .","The TeX system , developed by Donald E. Knuth at the end of the 1970s , is another widespread and powerful automated typesetting system that has set high standards , especially for typesetting mathematics ."
"The Vincennes porcelain factory was established in 1740 , and moved later to larger premises in Sèvres .","The Vincennes porcelain factory was established in 1740 , moving to larger premises at Sèvres in 1756 ."
"In the 1960s , he helped establish the Freedom National Bank , an African-American-owned/controlled financial business based in Harlem , New York .","In the 1960s , he helped establish the Freedom National Bank , an African-American-owned financial institution based in Harlem , New York ."
"In business management , Gnosjö is well-known for the Gnosjö Spirit ( ) .","In business management , Gnosjö is known for the Gnosjö Spirit ( ) ."
Much of the crew 's work is made up of cargo runs or smuggling .,Much of the crew 's work consists of cargo runs or smuggling .
"Most often , trades are done between two teams , but there are times where trades are made between three or more teams .","Typically , trades are completed between two clubs , but there are instances where trades are consummated among three or more clubs ."
"Six years later , he opened `` Uncle Jack 's Steakhouse '' , which has three locations in New York City .","Six years later , he created Uncle Jack 's Steakhouse ."
Several countries have laws that define production vehicles .,Various countries have laws that define production vehicles .
Avoiding those users also means avoiding several significant articles where they obsess and dwell .,Avoiding those users also means avoiding some significant articles where they obsess and dwell .
"The very first Bridgestone tire was produced on April 9 , 1930 , by the Japanese `` Tabi '' Socks Tyre Division .","The very first Bridgestone tire was produced on 9 April 1930 , by the Japanese `` Tabi '' Socks Tyre Division ( actually made jika-tabi ) ."
Port-au-Prince is the nation 's largest centre of economy and finance .,Port-au-Prince is one of the nation 's largest centers of economy and finance .
Factories were fitted with overhead driveshafts providing rotary power .,Factories were fitted with overhead line shafts providing rotary power .
He was the co-founder of the Quantum Fund and creator of the Rogers International Commodities Index ( RICI ) .,"In 1998 , Rogers founded the Rogers International Commodity Index ."
"By then Boulton had managed the business for several years , and he expanded it considerably at the Soho Manufactory , built by him near Birmingham .","By then Boulton had managed the business for several years , and thereafter expanded it considerably , consolidating operations at the Soho Manufactory , built by him near Birmingham ."
"On December 21 , 2010 , Sugartown Worldwide , Inc. was bought by Oxford Industries , Inc .","On December 21 , 2010 , Sugartown Worldwide , Inc. was purchased by Oxford Industries , Inc ."
"In general , the load they can carry is measured in Twenty-foot equivalent units ( abbreviated `` TEU '' ) .",Container ship capacity is measured in twenty-foot equivalent units ( TEU ) .
The crash signalled the beginning of the 10-year Great Depression that affected all Western industrialized countries .,The crash signaled the beginning of the 10-year Great Depression that affected all Western industrialized countries .
"Miller 's contract with the stadium was for $ 40 million , and it will last until the year 2020 .","Miller 's contract with the stadium was for $ 40 million , and runs until 2020 ."
"He accumulated enormous debts ( they totalled 21 million livres ) , which Louis XVI paid for him in the early 1780s .","He accumulated enormous debts , totalling 21 million livres ."
In later years Schwerin von Krosigk wrote several books about economics policy and two versions of his memoirs .,"In later years , Schwerin von Krosigk wrote several books on economic policy and two versions of his memoirs ."
Tehran is also a leading center for the sale of carpets and furniture .,Tehran is the economic center of Iran .
The sponsor of the stadium is the Miller Brewing Company .,The title sponsor is the Miller Brewing Company .
Ballard then worked for an advertising agency and as an encyclopedia salesman .,Ballard then worked as a copywriter for an advertising agency and as an encyclopaedia salesman .
"Because of this , McClung argued that Congress had no power to regulate Ollie 's Barbecue under the Commerce Clause .","Consequently , McClung argued that Congress had no power to regulate Ollie 's Barbecue under the Commerce Clause ."
"In 1969 , `` Galaxy '' was sold to Universal Publishing and Distribution Corporation ( UPD ) and Pohl quit .","In 1969 , Guinn sold `` Galaxy '' to Universal Publishing and Distribution Corporation ( UPD ) ."
A related idea is William Blackstone 's formulation : `` It is better that ten guilty persons escape than that one innocent suffer '' .,A related idea is Blackstone 's formulation `` It is better that ten guilty persons escape than that one innocent suffer '' .
It is currently being produced by Beam Suntory .,The brand is now produced by Beam Suntory .
He served as Minister of Transportation from 1971 until 1972 and as Mister of Commerce from 1979 until 1981 .,He later served as minister of transportation from 1971 to 1972 and minister of commerce and trade from 1979 to 1981 .
"However , shortly before release of their first album , Sony ended their contract .","Shortly before release of their first album , Sony terminated their contract ."
He had the idea to build up a stronger market for the collecting of coins .,He nurtured an idea of building up a stronger market for the collecting of coins .
"Carl Degenkolb , owner of a factory in Eilenburg and member of Frankfurt Parliament , instituted first German works councils voluntarily at his factory .","Carl Degenkolb , owner of a factory in Eilenburg and member of the Frankfurt Parliament , voluntarily instituted the first German works councils at his factory ."
"He eventually finds that his brother is `` Herbert Powell '' , the head of a car maker .","He eventually discovers that his brother is Herbert Powell , a car manufacturer ."
Deb or DEB may mean :,Deb or DEB may refer to :
He left in 1985 to start his own business .,He resigned in 1985 to start his own business .
The Banco de Costa Rica was established in 1890 and issued notes from 1890 to 1914 .,The Banco Anglo–Costarricense was established in 1864 and issued notes from 1864 to 1917 .
"During this time he wrote many newspaper articles , was the Irish correspondent for the Economist Magazine , and was encouraged to write on National Accounts and economics by the Features Editor in `` The Irish Times '' .","During this time he wrote many newspaper articles , was the Irish correspondent for The Economist magazine , and was encouraged to write on National Accounts and economics by the Features Editor in `` The Irish Times '' ."
"In 1935 , Shamir went to Palestine , where he worked in an accountant’s office .","In 1935 , Shamir migrated to Palestine , where he worked in an accountant 's office ."
"Historically , the town was home to a manufacturing industry with a woollen mill and foundry being key employers .","Historically , the town was home to a vibrant manufacturing industry with a woollen mill and foundry being key employers ."
"Tyco International , General Motors , and Michelin Shenyang Tire Corporation , are expanding their operations in Shenyang due to a deep pool of skilled technical labor ; good transportation ; low land-use fees ; and solid local support .","Tyco International , General Motors , and Michelin Shenyang Tyre Corporation , are expanding their operations in Shenyang due to a deep pool of skilled technical labor ; good transportation ; low land-use fees ; and solid local support ."
"That evening the Poles captured a major German weapons building , the main post office and power station , Praga railway station and the tallest building in Warsaw , the Prudential building .","That evening the resistance captured a major German arsenal , the main post office and power station and the tallest building in Warsaw , the Prudential building ."
The city is one of the country 's principal economic and educational centers .,Mek'ele is one of Ethiopia 's principal economic and educational centers .
The office structure was built on top of the bus station .,The office structure was built on top of the bus depot .
Iwami Ginzan Silver Mine was very important in East Asian trade because silver was the main currency .,"Iwami Ginzan Silver Mine played a pivotal role in East Asian trade , where silver was a key currency ."
announced that Bing would power Yahoo !,announced a deal in which Bing would power Yahoo !
"In 1879 , Franklin Winfield Woolworth opened his first successful `` five and dime '' store in the city of Lancaster .","In 1879 , Franklin Winfield Woolworth opened his first successful `` five and dime '' store in the city of Lancaster , the F. W. Woolworth Company ."
Bombardier Transportation is the rail equipment division of the Bombardier Inc.. Bombardier Transportation is the world’s largest company in the rail equipment manufacturing and servicing industry .,Bombardier Transportation is the rail equipment division of the Canadian firm Bombardier Inc. Bombardier Transportation is one of the world 's largest companies in the rail vehicle and equipment manufacturing and servicing industry .
"After this , portraits of the head packer were no longer allowed .","Following this , portraits of the head packer were no longer allowed ."
"That was the first edition of the so-called `` Strunk & White '' , which `` Time '' called in 2011 `` one of the 100 best and most influential books written in English since 1923 '' .","That was the first edition of the so-called `` Strunk & White '' , which `` Time '' named in 2011 one of the 100 best and most influential books written in English since 1923 ."
"Workplace democracy is a form of democracy in all its forms ( including voting systems , debates , democratic structuring , due process , adversarial process , systems of appeal ) to the workplace .","Workplace democracy is the application of democracy in all its forms ( including voting systems , debates , democratic structuring , due process , adversarial process , systems of appeal ) to the workplace ."
He had served as Trafigura 's chairman and CEO .,He had previously served as Trafigura 's chairman and CEO .
"OPEC sets production targets for its member nations and generally , when OPEC production targets are reduced , oil prices increase .","Generally when OPEC production targets are reduced , oil prices increase ."
MyWikiBiz is a wiki directory that lets people write about themselves .,MyWikiBiz is a wiki directory that allows people and enterprises to write about themselves .
"The town of Dubai was an important port of call for foreign tradesmen ( chiefly Indians ) , who settled in the town .","The town of Dubai was an important port of call for foreign tradesmen , chiefly those from Iran , many of whom eventually settled in the town ."
"Much of the news content is produced by the ABC itself , however many programs come from the BBC World Service , NPR , Deutsche Welle , Radio Netherlands and CNN Radio .","Much of its news content is produced by the ABC itself , however many programmes are relayed from the BBC World Service , NPR , Deutsche Welle , Radio Netherlands and CNN Radio ."
"After his son graduated from Doland 's high school , Hubert Humphrey , Sr. left Doland and opened a new drugstore in the larger town of Huron , South Dakota ; a population of 11,000 people , where he hoped to improve his fortunes .","After his son graduated from Doland 's high school , Hubert Humphrey Sr. left Doland and opened a new drugstore in the larger town of Huron , South Dakota , ( population 11,000 ) , where he hoped to improve his fortunes ."
"Professional certification , trade certification , or professional designation , often called simply `` certification '' or `` qualification '' , is a certification a person gets to assure that he/she is qualified to perform a job or task .","Professional certification , trade certification , or professional designation , often called simply `` certification '' or `` qualification '' , is a designation earned by a person to assure qualification to perform a job or task ."
"The band were created in 1991 by Promoe and Embee , the band was complete in 1996 .",Looptroop was formed in 1991 by Promoe and Embee .
and AOL came to a deal where Microsoft 's Live Communication Server 2005 ( which is interestingly also used by Reuters for its Reuters Messaging service ) users would also have the possibility to talk to public instant messaging users .,and AOL agreed to a deal in which Microsoft 's Live Communications Server 2005 users would also have the possibility to talk to public instant messaging users .
There were three hotels in Williamstown by 1841 and most of the men worked at the port .,There were three hotels in Williamstown by 1841 and most of the men worked at occupations related to the port .
"The Kennedy Expressway and Dan Ryan Expressways are the busiest state maintained routes in not only the City of Chicago and its suburbs , but also the entire state of Illinois .",The Kennedy and Dan Ryan Expressways are the busiest state maintained routes in the entire state of Illinois .
"However , many manufacturers are allowed to also add sell-by or use-by dates .","However , many manufacturers also add sell-by or use-by dates ."
"He wrote several books , including `` The Rise and Growth of Economic Nationalism '' .","He authored several books , including `` The Rise and Growth of Economic Nationalism '' ."
SONAR was designed using technologies Symantec acquired from WholeSecurity .,Spam filtering uses technologies Symantec acquired from Brightmail .
"Between 1911 and 1913 , he worked for his uncle in the office of the Branch coal mines in West Virginia .","Between 1911 and 1913 , he was employed by his uncle in the office of the Branch coal mines in West Virginia ."
"Best known are perhaps the Cacao tree , the source of cocoa and chocolate .",Cacao is commercially valued as the source of cocoa and chocolate .
The investment cost for the Waldpolenz solar park amounts to some Euro 130 million .,The investment costs for the Waldpolenz solar park have amounted to some 130 million euro .
The remaining functions were taken over by so-called `` joint-boards '' .,The remaining functions were taken over by joint boards .
British Rail Class 314 alternating current ( AC ) electric multiple units ( EMU ) were built by BREL at York works from 1978 to 1979 .,British Rail Class 314 alternating current ( AC ) electric multiple units ( EMU ) were built by BREL York works in 1979 .
"Bizzar is the sixth studio album by American Horrorcore band , Insane Clown Posse and is the second half of `` Bizaar '' .",Bizzar is the seventh studio album by Insane Clown Posse .
"McMahon married his wife , Linda McMahon , on August 26 1966 in New Bern , North Carolina .","McMahon married Linda McMahon on August 26 , 1966 in New Bern , North Carolina ."
"The BBC is established under a Royal Charter , which allows the BBC to broadcast .",The BBC operates under a Royal Charter .
"On March 18 , 2014 , he resigned as Minister of Finance in order to return to the private sector .","On March 18 , 2014 , Flaherty announced that he was resigning as Minister of Finance in order to return to the private sector ."
Factory brok through in Sweden with the 1978 single `` Efter plugget '' 1978 .,Factory broke through in Sweden with the 1978 single `` Efter plugget '' 1978 .
"Ghosn is also Chairman and CEO of the Renault-Nissan Alliance , the strategic partnership overseeing the two companies through a unique cross-shareholding agreement .","Ghosn is also Chairman and CEO of the Renault-Nissan Alliance , the strategic partnership overseeing Nissan and Renault through a unique cross-shareholding agreement ."
Peter Barry ( born 10 August 1928 ) is a retired Irish politician and businessman .,Peter Barry ( born 10 August 1928 ) is a retired Irish Fine Gael politician and businessman from Cork city .
"Such an instrument is often called the organization 's bylaws , regulations , or agreement of association .","Such an instrument is often called the organization 's bylaws , constitution , regulations , or agreement of association ."
"As of 30 September 2009 , Bookcrossing.com had over 814,000 members , with over 5,800,000 registered books .","As of 23 July 2010 , Bookcrossing.com had over 871,000 members , with over 6,427,000 registered books ."
"In exchange for making the railroad , Costa Rican gave Keith large amounts of land and a lease on the train route , which he used to produce bananas and export them to the United States .","In exchange for completing the railroad , the Costa Rican government granted Keith large tracts of land and a lease on the train route , which he used to produce bananas and export them to the United States ."
"Her mother , Betty Lou Motes ( nee Bredemus ) , was a one-time church secretary and real estate agent , and her father , Walter Grady Roberts , was a vacuum cleaner salesman .","Roberts ' mother , became a church secretary and real estate agent , and her father , a vacuum cleaner salesman ."
Stillwater is also the home of Oklahoma State University .,The city 's largest employer is Oklahoma State University .
"The RSA was set up to `` embolden enterprise , enlarge science , refine art , improve our manufactures and extend our commerce '' , but also to reduce poverty and secure full employment .","The RSA 's mission expressed in the founding charter was to `` embolden enterprise , enlarge science , refine art , improve our manufacturers and extend our commerce '' , but also of the need to alleviate poverty and secure full employment ."
The arrival of the railway increased its economy and productivity .,The introduction of the rail line increased its economy and productivity .
"In addition , a four member `` non officer management advisory team '' was appointed in August 2006 to advise on implementing change options and addressing management and leadership challenges facing the Gardaí .","In addition , a four-member `` non-officer management advisory team '' was appointed in August 2006 to advise on implementing change options and addressing management and leadership challenges facing the ."
Their single `` Love Your Money '' reached number 26 in the UK Singles Chart in February 1992 .,`` Love Your Money '' reached number 26 in the UK Singles Chart in February 1992 .
"These women received pay in coin , home industries , alcohol , baked goods , and other valuables .","These women received `` tuition '' in coin , home industries , alcohol , baked goods , and other valuables ."
"According to `` The Commercial Appeal '' , Jones had not listened to the show before the incident , and was unaware of its views .","According to `` The Commercial Appeal '' , Jones had not listened to the show before the incident , and was unaware of its ideology ."
