They killed him when he tried to lead them to the king 's manor to pay a trading tax on their goods .,They murdered him when he tried to get them to accompany him to the king 's manor to pay a trading tax on their goods .
Paid sick leave is a requirement in many nations around the world .,Paid sick leave is a statutory requirement in many nations around the world .
"The main characteristic of the place is the crafty production of `` coastal salt '' , oysters and choros .","The economy is based on the production of coastal salt , oysters , and choros ."
"Hilo expanded as sugar plantations in the surrounding area created new jobs and drew in many workers from Asia , making the city a trading center .","Hilo expanded as sugarcane plantations in the surrounding area created new jobs and drew in many workers from Asia , making the town a trading center ."
She 's also co-founder and chairman of Artemis Real Estate Partners .,She is also co-founder of Artemis Real Estate Partners .
"Member of the Research Centre Economies , Societies , Cultures , his research focuses on the history of cultural policies , the history of cities and equipment .","Member of the Research Centre Economies , Societies , Cultures , his research focuses on the history of cultural policies , the history of new towns and the history of the equipment ."
"At the same time , many students and alumni leaders criticized his hands-off approach toward the student body and his focus on the business operations of Cornell .","At the same time , Rawlings faced criticism from many students and alumni leaders for his hands-off approach toward the student body and his focus on the business operations of Cornell ."
He has won seven world championship titles and has the most Grand Prix victories in the world .,He won two titles with Benetton in and .
"Lee 's younger son , Lee Hsien Yang , is also a former Brigadier General and is a former President and Chief Executive Officer of SingTel , a pan-Asian telecommunications giant and Singapore 's largest company by market capitalisation ( listed on the Singapore Exchange , SGX ) .","His younger son , Lee Hsien Yang , was also a former Brigadier-General and former President and Chief Executive Officer ( CEO ) of SingTel ."
"Organizations that opposed the bill include the : U.S. Chamber of Commerce , Eagle Forum , Society for Human Resource Management , National Association of Manufacturers , American Bakers Association , College and University Professional Association for Human Resources , Associated Builders and Contractors , and American Housing & Lodging Association .","U.S. Chamber of Commerce , Eagle Forum , Society for Human Resource Management , National Association of Manufacturers , American Bakers Association , College and University Professional Association for Human Resources , Associated Builders and Contractors , and American Hotel & Lodging Association ."
The offices behind those windows were empty because of repairs .,The offices behind those windows were vacant due to renovations .
"Despite its opposition , industries from that country are constructing their infrastructure in Cúcuta to export their products to the United States , registering their products as if they were Colombian , an strategy that would allow them to export without paying certain tariffs .","Despite this opposition , industries from Venezuela are constructing their infrastructure in Cúcuta to export their products to the United States , registering their products as if they were Colombian , a strategy that allow them to export without paying certain tariffs ."
"Six years later , he opened `` Uncle Jack 's Steakhouse '' , which has three locations in New York City .","Today , he owns three locations in New York City ."
"As of June 30 , 2015 , the game has daily revenues of $ 4.2 million .","As of June 30 , 2015 , daily revenues reached $ 4.2 million ."
"The album 's lead single , `` Skyscraper '' , was acclaimed for its messages of self-worth and confidence , peaked at number 10 on the `` Billboard '' Hot 100 , selling 176,000 downloads during the first week of release , becoming Lovato 's highest first week sales , until the release of `` Heart Attack '' by Lovato in 2013 .","The second single , `` Made in the USA '' peaked at number 80 on `` Billboard '' Hot 100 chart ."
"Wix was created in 2006 by Avishai Abrahami , Nadav Abrahami and Giora Kaplan .","Wix was founded in 2006 by Avishai Abrahami , Nadav Abrahami , and Giora Kaplan ."
Star Alliance is the world 's first and largest airline alliance .,Star Alliance is the world 's largest global airline alliance .
"John J. Farrell ( 1872 - July 22 , 1946 ) was the Dairy and Food Commissioner of Minnesota in 1917 and president of the National Creamery Buttermakers ' Association .",By 1917 he was the Dairy and Food Commissioner of Minnesota and president of the National Creamery Buttermakers ' Association .
"It was started in 1830 by Haarmann & Kathagen , the brewery was one of the first worldwide to switch from wooden to metal barrels .","Established in 1830 by Haarmann & Kathagen , the brewery was one of the first worldwide to switch from wooden to metal storage containers ."
"One Worldwide Plaza is a skyscraper in New York City , United States .","One Worldwide Plaza is a 50-story , , office skyscraper ."
Insurance firms use a value called the embedded value ( EV ) .,"For insurance firms , a value called the embedded value ( EV ) has been used ."
"In talks with investors of the movie , they presented an eight-minute documentary along with newspapers and news footage .","In talks with investors , they presented an eight-minute documentary along with newspapers and news footage ."
"For the next six years she worked in provincial companies , in particular those in York and Bath .","For the next six years she worked in provincial companies , in particular York and Bath ."
They also resisted employing pay drivers more than most other teams short on money .,They also resisted employing pay-drivers more than most other financially strapped teams .
"He represented the company , was promoted to a partner , and traveled to many places .","He represented the company promoted to a partner , and traveled widely ."
"By 1979 , it had 39 printing branches worldwide .","By 1979 , the society had 39 printing branches worldwide ."
It was built to hold the corporate headquarters of the Wrigley Company .,It was built to house the corporate headquarters of the Wrigley Company .
2 operated by Abellio Greater Anglia,"Operated by Abellio Greater Anglia ,"
"The Olsens have a clothing line for girls ages 4-14 in Wal-Mart stores across North America , as well as a beauty line called `` Mary-Kate and Ashley : Real fashion for real girls '' .","The Olsens had a clothing line for girls ages 4–14 in Wal-Mart stores across North America , as well as a beauty line called `` Mary-Kate and Ashley : Real fashion for real girls '' ."
"The United States Secretary of Commerce is the head of the United States Department of Commerce concerned with business and industry ; the Department states its mission to be `` to foster , promote , and develop the foreign and domestic commerce . ''",The United States Secretary of Commerce is the head of the United States Department of Commerce .
Montevideo is the capital and the largest city in Uruguay .,Montevideo is the heartland of retailing in Uruguay .
"Diversified economies of Karachi and Punjab 's urban centres , coexist with lesser developed areas in other parts of the country .",The diversified economies of Karachi and Punjab 's urban centres coexist with less developed areas in other parts of the country particularly in Balochistan .
Abramoff and his partner Michael Scanlon ( a former Tom DeLay aide ) conspired to bilk Indian casinos of about $ 85 million .,"Abramoff and his partner , Michael Scanlon ( a former Tom DeLay aide ) , conspired to bilk Indian casino gambling interests out of an estimated $ 85 million in fees ."
"The Western Region of British Railways ( in view of post-World War II sensibilities ) negotiated a licence with German manufacturers to scale down the German Federal Railway 's `` V200 '' design to suit the smaller loading gauge of the British network , and to allow British manufacturers to construct the new design .","The Western Region of British Railways negotiated a licence with German manufacturers to scale down the German Federal Railway 's `` V200 '' design to suit the smaller loading gauge of the British network , and to allow British manufacturers to construct the new locomotives ."
The Takeda attacked the castle because it threatened supply lines .,The Takeda forces attacked the castle because it threatened Takeda 's supply lines .
"The original ringing chamber had five bells , but none of them has survived .",None of these bells has survived .
He was sentenced to four years in jail for a defense deal corruption case .,He was sentenced to four years in jail for defence deal corruption case .
"The advisers were also mandated to promote the ideas of performance management , succession planning , recruitment of non officers with specialist expertise , and improved training .","The advisers were also mandated to promote a culture of performance management , succession planning , recruitment of non-officers with specialist expertise , and improved training ."
"The Cooper Corporation , the M and M Company , and The Falls Rubber company merged in 1930 to form the `` Master Tire and Rubber Company '' .",The company name was changed to Cooper Tire & Rubber Company in 1946 .
"It has the headquarters of the Eastern Caribbean Central Bank , as well as the Eastern Caribbean Securities Exchange , which lists securities for companies and corporations in the region .","It is home to the headquarters of the Eastern Caribbean Central Bank , as well as the Eastern Caribbean Securities Exchange , which lists securities for companies and corporations in the region ."
The Great Depression happened just as James ' records were put on the market .,The Great Depression struck just as James 's recordings were hitting the market .
Maley & Taunton were a tram and tramway engineering company .,Maley & Taunton is a defunct tram and tramway engineering company .
"In 1965 , Joyce took over the Tim Horton Donut Shop on Ottawa Street North in Hamilton .","In 1965 , Joyce took over the fledgling Tim Horton Donut Shop on Ottawa Street North in Hamilton ."
"The construction of the building started in 1973 , and cost AU $ 82 million .",The building cost $ 82 million .
"He led Kaiser-Frazer followed by Kaiser Motors , automobile company known for the safety of their designs .","He led Kaiser-Frazer followed by Kaiser Motors , automobile companies known for the safety of their designs ."
"The only other Oasis songs to feature both of them on lead vocals are `` Put Yer Money Where Yer Mouth Is '' , from their 2000 album `` Standing on the Shoulder of Giants '' , `` Born on a Different Cloud '' , from their 2002 album `` Heathen Chemistry '' , and `` Let There Be Love '' , from their 2005 album `` Do n't Believe the Truth '' .","The only other Oasis songs to feature both brothers on lead vocals are `` Put Yer Money Where Yer Mouth Is '' , from their 2000 album `` Standing on the Shoulder of Giants '' , `` Born on a Different Cloud '' , from their 2002 album `` Heathen Chemistry '' , and `` Let There Be Love '' , from their 2005 album `` Do n't Believe the Truth '' ."
"HIV/AIDS has slowed economic growth by destroying human capital , the ability of people to make money in society .",HIV/AIDS has retarded economic growth by destroying human capital .
The freight market share of the railways are also expected to rise quickly with the completion of the Kars–Tbilisi–Baku railway in 2012 .,The freight market share of the railways are also expected to rise rapidly with completion of the Kars–Tbilisi–Baku railway .
"With independence , Azerbaijan became a member of the International Monetary Fund , the World Bank , the European Bank for Reconstruction and Development , the Islamic Development Bank and the Asian Development Bank .","After gaining independence in 1991 , Azerbaijan became a member of the International Monetary Fund , the World Bank , the European Bank for Reconstruction and Development , the Islamic Development Bank and the Asian Development Bank ."
"The United States , Japan and the European Union are three economic powers which have a skilled workforce and access to capital .","The United States , Japan and the European Union are three economic powers who possess a skilled workforce and access to capital ."
"Eventually , she was selling more dresses than juice , and decided to focus on making and selling what had become known as her `` Lillys '' .","Eventually , she was selling more dresses than juice , and decided to focus on designing and selling what had become known as her `` Lillys '' ."
In Sydney it is closely linked with `` The Daily Telegraph '' and `` The Sunday Telegraph '' .,"In Brisbane , it is linked with `` The Courier-Mail '' and `` The Sunday Mail '' ."
"`` Bell , Book and Candle '' received Academy Award nominations in two categories : Best Art Direction for Cary Odell and Louis Diage ; and Best Costume Design for Jean Louis .","`` Bell , Book and Candle '' received Academy Award nominations in two categories : Best Art Direction ( Cary Odell and Louis Diage ) ; and Best Costume Design ( Jean Louis ) ."
"The law was a direct answer to the `` Ledbetter v. Goodyear Tire & Rubber Co. '' , , a U.S. Supreme Court decision holding that the statute of limitations for presenting an equal-pay lawsuit begins on the date that the employer makes the initial discriminatory wage decision , not at the date of the most recent paycheck , as a lower court had ruled .","The law directly addressed `` Ledbetter v. Goodyear Tire & Rubber Co. '' , , a U.S. Supreme Court decision that the statute of limitations for presenting an equal-pay lawsuit begins on the date that the employer makes the initial discriminatory wage decision , not at the date of the most recent paycheck ."
"The `` Red Lion '' also arrived at the Outer Banks , but it dropped off its passengers and went to Newfoundland for privateering .",The `` Red Lion '' had dropped off its passengers and left for Newfoundland for privateering .
Some critics asserted that the award affirms neoliberalism .,Some critics said that the award affirms neoliberalism .
"In modern times , commercial activity shifted from the major trade routes of the Old World to newer routes between modern nation states .","In modern times , commercial activity shifted from the major trade routes of the Old World to newer routes between modern nation-states ."
"He retired in 1950 , but he continued to be a legal advisor in Laubach .",For the next three years he was a legal advisor in Laubach .
"After she reached the very top of her profession , `` That 's when I started getting nervous ... that’s when I started putting a lot of pressure on myself '' .","After she reached the pinnacle of her profession , `` That’s when I started getting nervous ... that’s when I started putting a lot of pressure on myself . ''"
British Rail 's Class 27 was a diesel locomotive built by the Birmingham Railway Carriage and Wagon Company ( BRCW ) during 1961 and 1962 .,British Rail 's Class 27 comprised 69 diesel locomotives built by the Birmingham Railway Carriage and Wagon Company ( BRCW ) during 1961 and 1962 .
"It was usually a private property , even closely held secrets , used for commercial or military advantage .","These were usually the private property , even closely held secrets , of individuals who used them for commercial or military advantage ."
"The main industry in Auvergne is the tyre industry , represented by `` Michelin '' , with headquarters and history in Clermont-Ferrand , and `` Dunlop '' in Montluçon .","The main industry in Auvergne is the tyre industry , represented by Michelin , with headquarters and history is located in Clermont-Ferrand , and Dunlop , based in Montlucon ."
"Since it has started , the chart has been renamed many times to accurately reflect the music industry at that time .","Since its inception , the chart has changed its name many times in order to accurately reflect the industry at the time ."
It is now a division of Allied Artists International .,The company is now a division of Allied Artists International .
"Allen provided the money to build and fly SpaceShipOne , about US $ 25 million .",Allen provided the funding of approximately US $ 25 million .
OneNote is a important part of Microsoft Office Enteprise and Ultimate 2007 .,OneNote is available as a part of Microsoft Office and Windows 10 .
"Located on the south coast of the island of Efate , it has the country 's most important dock and airport , Bauerfield International , making it the nation 's economic and commercial center .","Situated on the south coast of the island of Efate , in Shefa Province , Port Vila is the economic and commercial centre of Vanuatu ."
"At about 3 a.m. ( Local Time ) , Breckinridge and his small army began to travel across Walkers Mountain .","At about 3 a.m. , Breckinridge and his small company began to cross Walkers Mountain ."
He also studied at the College of Hotel Management in Bad Reichenhall in Bavaria .,He studied at the `` College of Hotel Management Bad Reichenhall '' in Bavaria .
He went on to become a vice president of an industrial relations in .,"He went on to become a vice-president of an industrial relations firm in Toledo , Ohio ."
"The song is known by its tune , and its chorus , `` C'est la Lutte Finale / Groupons-nous , et demain / L'Internationale / Sera le genre humain '' .",The original French refrain of the song is `` C'est la lutte finale / Groupons-nous et demain / L'Internationale / Sera le genre humain . ''
"Glendale also is home to Midwestern University , metro Phoenix 's first medical school , as well as a major post-graduate international business school .","Glendale also is home to Midwestern University , metropolitan Phoenix 's first medical school , as well as a major post-graduate international business school : the Thunderbird School of Global Management ."
Damascus also holds an annual international trade exposition in the fall since 1955 .,"Damascus has also held an annual international trade exposition every fall , since 1955 ."
Abbreviated CBM in the freight business and MTQ ( or numeric code 49 ) in international trade .,Abbreviated CBM and cbm in the freight business and MTQ ( or numeric code 49 ) in international trade .
"The national office ( NO ) in New York City had only a few desks , some broken chairs , a couple of filing cabinets , and a few typewriters .","The national office ( NO ) in New York City consisted of a few desks , some broken chairs , a couple of file cabinets and a few typewriters ."
"After it was built by Baldwin , the engine was shipped across the Atlantic in parts , and re-assembled at Pilton by railway staff .","After construction by Baldwin , the loco was shipped across the Atlantic in parts , and re-assembled at Pilton by railway staff ."
He studied philosophy at the City College of New York and worked in his father 's business making clothing .,He studied philosophy at the City College of New York and worked in his father 's business manufacturing clothing .
He found Indiana businessman Tony Hulman .,He found Terre Haute businessman Tony Hulman .
"August Belmont and Company was an instant success , and Belmont restored health to the Rothschild 's US interests over the next five years .","August Belmont & Company was an instant success , and Belmont restored health to the Rothschild 's U.S. interests over the next five years ."
Durban ( Zulu : `` eThekwini '' ( IPA : ) has the second largest population of a city in South Africa .,Durban remains the third richest city in South Africa .
Moves towards automated ticketing were first made by the then state Liberal Government in 1992 .,Moves towards automated ticketing were first made in 1992 .
"In 1849 Nathaniel Cook registered a chess set design , and Jaques of London got the manufacturing rights .","In 1849 Nathaniel Cook registered a chess set design , and Jaques of London obtained the manufacturing rights ."
Hermann van Pels worked at Pectacon as a helper about spices .,Hermann van Pels was employed by Pectacon as an advisor about spices .
The town was first run as a company town and was managed by Cariboo Gold Quartz Mine .,"Originally a company town , was managed by `` Cariboo Gold Quartz Mine '' ."
"The British Rail Class 99 was a fleet of 14 ferries , mostly owned by Sealink , which carried rail vehicles between Britain and mainland Europe .","The British Rail Class 99 was a fleet of 14 ferries or train ferries , most of which were owned by Sealink , that carried rail vehicles between Britain and mainland Europe ."
"On 24 May 2007 , the council sold their remaining stake in the company for over £107 million .",On 24 May 2007 it sold its remaining stake in the company for over £107 million .
"In the 1990s , he published articles and books about software and computer networks ; these books were in German , but he also wrote articles in English .","In the 1990s , Ebner published articles and books on software and networking topics ; while these books were written in German , he also wrote some articles in English ."
Two goods are substitutes if the demand of one good increases and the price of the other good increases .,This means a good 's demand is increased when the price of another good is increased .
Best British Production Design - Black and White,Best British Production Design - Colour
Furthermore she completed the `` Executive Management Program '' at Columbia University and the `` Executive Leadership Program '' at Harvard University .,"In addition , she completed the `` Executive Management Program '' at Columbia University and the `` Executive Leadership Program '' at Harvard University ."
"In this episode , Homer becomes ashamed of his family after a bad company picnic and decides to enter them in .","In the episode , Homer becomes ashamed of his family after a catastrophic company picnic and decides to enroll them in therapy ."
"ZoneAlarm is a software firewall originally developed by Zone Labs , which was acquired in March 2004 by Check Point .","ZoneAlarm was developed by Zone Labs , which was acquired in March 2004 by Check Point ."
"The trade with Haiti is important , mainly in Comendador .","The trade with Haiti is important , above all in Comendador ."
"Sompote was also required to pay THB 10,700,000 plus interest at the rate of 7.5 per cent a year starting from December 16 , 1997 , when the original law for ultraman 's right was filed .","Sompote was also required to pay THB 10,700,000 plus interest at the rate of 7.5 per cent a year starting from December 16 , 1997 , when the original lawsuit was filed ."
Airbus Industrie was officially started as a `` Groupement d'Interet Économique '' ( Economic Interest Group or GIE ) on 18 December 1970 .,Airbus Industrie was formally established as a `` Groupement d'Intérêt Économique '' ( Economic Interest Group or GIE ) on 18 December 1970 .
`` Camellia sinensis '' is of major commercial importance because tea is made from its leaves .,"`` Camellia sinensis '' , the tea plant , is of major commercial importance because tea is made from its leaves ."
"In response , the Phoenix Chamber of Commerce was created on November 4 1888 .","In response , the Phoenix Chamber of Commerce was organized on November 4 , 1888 ."
"Cloud , Minnesota 's major retail center account for Sartell 's lack of a traditional `` downtown '' .",Cloud 's major retail center account for its lack of a traditional `` downtown '' .
"Jairus Cassius Fairchild ( December 27 , 1801-October 24 , 1862 ) was an American politician and businessman .","Jairus Cassius Fairchild ( December 27 , 1801 – July 18 , 1862 ) was an American politician and businessman ."
"Following his graduation , he worked for the Sidley Austin LLP law firm .","Following his graduation , he joined the Sidley Austin law firm ."
"The 65-hectare Crawley campus is next to the Swan River , and located 5 km from the Perth central business district .","The 65-hectare Crawley campus sits on the Swan River , about five kilometres west of the Perth central business district ."
"Firestone was more than a billion dollars in debt at the time , and losing 250 million dollars a year .","It was more than a billion dollars in debt at the time , and losing 250 million dollars a year ."
"There are some 44,000 jobs created by the breeding , training and related support brought about by the horse industry that generates over $ 2.2 billion in yearly money .","44,000 jobs are sustained by breeding , training , and related support of the equine industry , which generates over $ 2.2 billion in annual revenue ."
"Kourtney Mary Kardashian ( born April 18 , 1979 ) is an American businesswoman , socialite , model , actress and reality television personality who gained fame as a cast member of `` Keeping Up with the Kardashians '' , `` Kourtney and Kim Take New York '' , and `` Kourtney and Khloé Take Miami '' .","Kourtney Mary Kardashian ( born April 18 , 1979 ) is an American reality television personality , actress , socialite , businesswoman and model ."
"Famously , RMS Titanic was carpeted using carpets manufactured by Stoddard Carpets , the parent company and successor to BMK .","The RMS Titanic was carpeted using carpets manufactured by Stoddard Carpets , the parent company and successor to BMK ."
