"He later started his own company , Calibron Industries , Inc. After that , he built his own laboratory in West Orange , New Jersey .","He later founded his own company , Calibron Industries , Inc. , and built his own smaller laboratory in West Orange ."
It is when cash or some other valuable object goes from a person or company to another person or company .,It is an outflow of cash or other valuable assets from a person or company to another person or company .
"The Wrangell Mountains are named after an explorer who was also president of the Russian-American Company , Admiral Ferdinand von Wrangel .","The mountains are named after explorer , president of Russian-American Company , and admiral Ferdinand von Wrangel ."
"In spite of the difference , this is the meaning in the name of the United States ' most famous maker of cookies and crackers , the National Biscuit Company ( now called Nabisco ) .","This sense is at the root of the name of the United States ' most prominent maker of cookies and crackers , the National Biscuit Company , now called Nabisco ."
It can be found on the B2116 road 2.4 miles south of Burgess Hill .,It lies on the B2116 road south of Burgess Hill .
The idea for the path was based on the success of the Pembrokeshire Coast Path National Trail and the Isle of Anglesey Coastal Path .,The idea was developed from a desire to build on the economic success of the Pembrokeshire Coast Path National Trail and the Isle of Anglesey Coastal Path .
"Josiah Wedgwood ( 12 July 1730 3 January 1795 , born in Burslem , Stoke-on-Trent ) was an English potter , who became famous for the industrialisation of pottery .",Josiah Wedgwood ( 12 July 1730 – 3 January 1795 ) was an English potter who founded the Wedgwood company .
Iwami Ginzan Silver Mine was very important in East Asian trade because silver was the main currency .,"Iwami Ginzan Silver Mine played a pivotal role in East Asian trade , where silver was a key currency ."
"Today , boutique may refer to a specialised firm , such as a boutique investment bank or boutique law firm .","This term can also refer to a specialized firm in other industries , such as a boutique investment bank or boutique law firm ."
"The first batch of units was classified 168/0 under TOPS and bore a large resemblance , both visually and in terms of electrical design , to the Class 165 units previously built by BREL at York .",The first batch of units was classified 168/0 under TOPS and resembled the Class 165 units previously built by BREL York .
The numbers were grouped also by the company that operated the route .,The numbers reflected the company that operated the route .
"New universities were founded , each writing books for business , law , grammar , history , and other topics , not only religious books , where earlier scripts were used .","New universities were founded , each producing books for business , law , grammar , history , and other pursuits , not solely religious works for which earlier scripts typically had been used ."
"According to an IDC analyst , in 2007 , HP had about 80 % of Itanium system revenue .","According to an IDC analyst , in 2007 , HP accounted for perhaps 80 % of Itanium systems revenue ."
"If the production process , its inputs , or its environment changes ( for example , the machines doing the manufacture begin to wear ) this distribution can change .","If the production process , its inputs , or its environment ( for example , the machines on the line ) change , the distribution of the data will change ."
"Billa was founded by Karl Wlaschek in 1953 , and are owned by Germany 's REWE Group .","The company , which was founded by Karl Wlaschek in 1953 , is currently owned by Germany 's REWE Group ."
"Shared IP addresses such as school and company networks or proxy servers are blocked a lot for which , unfortunately , may also affect users who have n't done anything wrong on the same network .","Shared IP addresses such as school and enterprise networks or proxy servers are frequently blocked for which , unfortunately , may also affect innocent editors on the same network ."
These show the importance of mahogany in the 18th and 19th century Belizean economy .,These are symbolic of the importance of mahogany in the 18th- and 19th-century Belizean economy .
he was awarded a doctorate at the London School of Economics .,Then he took a doctorate at the London School of Economics .
"The town 's largest business , the abalone co-operative , was started in 1967 .","The town 's largest employer , the abalone co-operative , was formed in 1967 ."
The city of Basseterre is a financial centre in the Eastern Caribbean .,The city of Basseterre has established itself as a financial centre in the Eastern Caribbean .
The city has a well-preserved downtown with a number of remaining historic businesses .,The city is notable for its well-preserved downtown with a number of remaining historic businesses .
The book was interesting to read and a great commercial success it was a best-seller .,The book was a commercial success .
"Sometimes , a ticket has to be validated ( marking the time of the ticket 's use ) .","Sometimes a ticket has to be validated , e.g ."
Small businesses often face a lot of problems because of their size .,Small businesses often face a variety of problems related to their size .
New Providence is the main commercial hub of The Bahamas .,New Providence functions as the main commercial hub of the Bahamas .
"In March 2010 , the airport was given the name Bristol Airport .","In March 2010 , the airport was rebranded as Bristol Airport ."
Here is Berg 's tone row in the Violin Concerto :,Here is Berg 's tone row :
"By 1937 Schoep 's Ice Cream had become well known locally and E. B. Schoephoester sold his company to Peter B. Thomsen , a butter maker .","By 1937 Schoep 's Ice Cream had grown in local popularity and E. B. Schoephoester sold his company to Peter B. Thomsen , a butter maker ."
"Lubbock was elected the first president of the Institute of Bankers in 1879 ; in 1881 he was president of the British Association , and from 1881 to 1886 president of the Linnean Society of London .",In 1879 Lubbock was elected the first president of the Institute of Bankers .
"Samuel Osgood ( February 3 , 1747 – August 12 , 1813 ) was an American merchant and statesman from Andover , Massachusetts .","Samuel Osgood ( February 3 , 1747 – August 12 , 1813 ) was an American merchant and statesman born in North Andover , Massachusetts , parent town of the Andovers ."
"The construction of the building started in 1973 , and cost AU $ 82 million .",The building cost $ 82 million .
"One of the most obvious features of the L & B was its rail vehicles , with the engines appearing first in a plain lined Holly green colour , later on a black base , with chestnut under-frames , pulling passenger carriages coloured terra-cotta with cream upper panels , and light grey goods wagons .","One of the most distinctive aspects of the L & B was its rolling stock , with the locomotives appearing originally in a livery of plain lined Holly green , later on a black base , with chestnut under-frames , hauling passenger carriages coloured terracotta with off-white upper panels , and light grey goods wagons ."
"Most of the animal trading business began to revolve around rail side markets such as those at Hassocks , Haywards Heath and Lewes train stations .","Most livestock trading began to centre on railside markets such as those at Hassocks , Haywards Heath and Lewes railway stations ."
Brussels Airlines was created as the result of the merger of SN Brussels Airlines and Virgin Express in March 2006 .,Brussels Airlines was created following the merger of SN Brussels Airlines ( SNBA ) and Virgin Express .
"The RSA was set up to `` embolden enterprise , enlarge science , refine art , improve our manufactures and extend our commerce '' , but also to reduce poverty and secure full employment .","The RSA 's mission expressed in the founding charter was to `` embolden enterprise , enlarge science , refine art , improve our manufacturers and extend our commerce '' , but also of the need to alleviate poverty and secure full employment ."
and AOL came to a deal where Microsoft 's Live Communication Server 2005 ( which is interestingly also used by Reuters for its Reuters Messaging service ) users would also have the possibility to talk to public instant messaging users .,and AOL agreed to a deal in which Microsoft 's Live Communications Server 2005 users would also have the possibility to talk to public instant messaging users .
The Box Office Mojo is a website based company which tracks the box office revenues in systematic and algorithmic style .,"Box Office Mojo is a website that tracks box office revenue in a systematic , algorithmic way , founded in 1999 ."
"For this , it applies both technical and human-centered disciplines such as control engineering , industrial engineering , organizational studies , and project management .","It overlaps technical and human-centered disciplines such as industrial engineering , control engineering , software engineering , organizational studies , and project management ."
"Palm oil production is clearing lots of forest , reducing the habitat of the Siamang , along with that of other species such as the Sumatran Tiger .","The palm oil production industry is clearing large swaths of forest , reducing the habitat of the siamang , along with that of other species , such as the Sumatran tiger ."
Arovell 's headquarter is in Gosau in Upper Austria and has branch offices in Vienna and Salzburg .,Arovell 's headquarters lies in Gosau in Upper Austria and has subsidiaries in Vienna and Salzburg .
"In 1882 , the Company founded a small settlement on Gaya Island ( Pulau Gaya ) , which was already inhabited by the Bajau people .","In 1882 , BNBC founded a small settlement in the area known as Gaya Bay , which was already inhabited by Bajau people ."
"All government documents , military communications , street signs , many shop signs , business contracts and other activities are in English .","But all government documents , street signs , many shop signs , business contracts and other activities use English ."
"He got his bachelors 's degree in business from the University of Cincinnati in Cincinnati , Ohio .",Geisinger then received his bachelors 's degree in business from the University of Cincinnati .
"In the center of the community , Flagler built two luxury resort hotels , the Royal Poinciana Hotel and The Breakers Hotel .","The nucleus of the community was established by Flagler 's two luxury resort hotels , the Royal Poinciana Hotel and The Breakers Hotel ."
"The company failed to tell the Environment Agency of the incident , as the site manager thought it was n't important .","The company failed to notify the Environment Agency of the discharge , as the site manager thought it was minor ."
"In 1950 , Hoberg changed its name to Charmin Paper Company and kept making toilet paper , paper napkins , and other paper products .","In 1950 , Hoberg changed its name to Charmin Paper Company and continued to produce bath tissue , paper napkins , and other paper products ."
"He produces a contract , which Nemorino signs ( with an X ) in return for the cash Belcore gives him on the spot .","Belcore produces a contract , which Nemorino signs in return for the money ."
He served as Chief Economist for the oil company Shell from 1995 to 1997 .,"Later , he served as Chief Economist for Shell from 1995 to 1997 ."
Professional Griefers is a song by Canadian electronic music producer deadmau5 and features vocals from American musician Gerard Way from My Chemical Romance .,`` Professional Griefers '' is a song by Canadian producer deadmau5 featuring vocals by Gerard Way .
"Several men abducted and threatened the family of the manager , tied up 14 staff members and stole over £53 million in banknotes from a Securitas depot in Tonbridge , Kent .","Several men abducted and threatened the family of the manager , tied up fourteen staff members and stole £53,116,760 in bank notes from a Securitas Cash Management Ltd depot in Vale Road , Tonbridge , Kent ."
"The district has an area of 15,910 square kilometres and is headquartered at the city of Khairpur .",and is headquartered at the city of Khairpur .
"His brothers , Moses and Benjamin , were important businessmen at Trois-Rivières and Montreal .",His brother Benjamin was an important businessman at Montreal .
"A graduate of Harvard College and Harvard Law School and attorney and bank executive in Boston , Massachusetts before taking public office , he was the person to serve in the newly created position of National Security Advisor during the Eisenhower Administration .","A graduate of Harvard College and Harvard Law School he became an attorney and bank executive in Boston , Massachusetts before taking public office ."
It became an educational and commercial success .,Westside Prep became an educational and commercial success .
"The Group has its headquarters in Washington , D.C..","The Group 's headquarters are in Washington , D.C ."
"Ronald Myles Dworkin , ( December 11 , 1931 – February 14 , 2013 ) was an American philosopher and scholar of constitutional law .","Ronald Myles Dworkin , FBA ( ; December 11 , 1931 – February 14 , 2013 ) was a Jewish-American philosopher , jurist , and scholar of United States constitutional law ."
"The main task of the Culture of Health is to implement innovative health programs that support a holistic approach to physical , mental and spiritual well-being .","Key element of a Culture of Health is implement innovative health programs that support a holistic approach to physical , mental and spiritual well-being both inside and outside the workplace ."
In 2010 Fernando directed the Nestlé 90 year anniversary campaign .,"In 2010 , Andrade directed the Nestlé 90th anniversary campaign ."
Her father was a skilled commercial artist .,Her father worked as a skilled commercial artist .
He owned big mining businesses in Lapland .,He owned a mining company in Lapland .
He found Indiana businessman Tony Hulman .,He found Terre Haute businessman Tony Hulman .
Claremont is paying for GLI 's indirect costs .,Claremont is funding GLI 's indirect costs .
"By 1979 , it had 39 printing branches worldwide .","By 1979 , the society had 39 printing branches worldwide ."
"In 1995 , Petronas become Sauber 's presenting sponsor .",1995 also saw Petronas become Sauber 's presenting sponsor .
"Southwest Airlines , US Airways , Delta Air Lines and American Airlines are the main airlines that use the airport .","Southwest Airlines , Delta Air Lines , and American Airlines are the predominant users of the airport ."
The company history began with the `` Tsukumo Shokai '' shipping company which was founded by the Tosa clan in 1870 .,The company traces its history back to the `` Tsukumo Shokai '' Shipping company founded by the Tosa clan in 1870 .
"The mill was sold in 1739 to Thomas Wilson , and an inventory of this time is still exists .",The mill was sold to Thomas Wilson in 1739 .
The company opened twice as many Canadian stores as did McDonald 's and sales also are bigger than those of McDonald 's Canadian restaurants as of 2002 .,The company opened twice as many Canadian outlets as McDonald 's and system-wide sales also surpassed those of McDonald 's Canadian operations as of 2002 .
"When signing their name for Indian business , a British King-Emperor or the Queen-Empress used the initials `` R I '' ( `` Rex/Regina Imperator/Imperatrix '' ) or the shorter version `` Ind .","When signing off Indian business , the reigning British king-emperors or queen-empress used the initials `` R I '' ( `` Rex/Regina Imperator/Imperatrix '' ) or the abbreviation `` Ind ."
"Together with WordPerfect , Novell was instrumental in making the Utah Valley a focus for high-technology software development .",It had been instrumental in making the Utah Valley a focus for technology and software development .
"In 1989 , he joined NBC 's cable news channel Consumer News and Business Channel and anchored its first news program .","In 1989 , he joined CNBC and anchored its first news program ."
"Several singles , including `` You Know How We Do It '' , became popular .",You Know How We Do It
EVA Air is largely privately owned and flies a fully international route network .,EVA Air is largely privately owned .
"Along with such artists as Sam Cooke , Ray Charles , and Junior Parker , Bland developed a sound that mixed gospel with the blues and R & B .",Bland developed a sound that mixed gospel with the blues and R & B .
A boss is a person who is in charge of workers in a company or organization .,A boss is a person in charge .
"Jean Peyrelevade , born ( 24 October 1939 in Marseille ) , is a French civil servant , politician and business leader .",Jean Peyrelevade ( born 1939 ) is a senior French center-left politician and business leader .
The Australian telephone numbering plan is how phone numbers work in Australia .,The Australian telephone numbering plan describes the allocation of phone numbers in Australia .
"Men at Work is an Australian reggae-influenced rock band that formed in 1979 in St. Kilda , a suburb of Melbourne .","Men at Work were an Australian rock band , which formed in 1978 ."
"For example , a breakfast cereal packaging line may be designed to fill each cereal box with 500 grams of product , but some boxes will have slightly more than 500 grams , and some will have slightly less , in accordance with a distribution of net weights .","For example , a breakfast cereal packaging line may be designed to fill each cereal box with 500 grams of cereal ."
"Labor Day ( in Canada , Labour Day ) is a holiday in the United States and Canada on the first Monday of September .",Canada 's Labour Day is also celebrated on the first Monday of September .
"He wrote some books about the economy , some of those books are `` La economía de tu vida '' and `` la Economía descubierta '' .",He wrote some books about the economy .
8-1-1 used to be a direct line to the business office of the telephone company giving service on the line .,"Traditionally , 8-1-1 has been a direct line to the business office of the telephone company providing service on the line ."
"Usually resort hotels featuring massive indoor water parks that are often reserved exclusively for overnight guests , companies like Great Wolf Resorts/Great Wolf Lodge and Kalahari Resorts have branched out from their origin in the Dells to open new locations around the country .",Companies like Great Wolf Resorts/Great Wolf Lodge and Kalahari Resorts have branched out from their origin in Wisconsin Dells to open new locations around the country .
"Lay was indicted by a grand jury in Houston , Texas , for his role in Enron 's collapse and was charged with 11 counts of securities fraud , wire fraud , and making false and misleading statements .","Lay was charged , in a 65-page indictment , with 11 counts of securities fraud , wire fraud , and making false and misleading statements ."
"The song is a parody of Slim Thug 's first single off his debut album , `` Already Platinum '' which was also called `` Like a Boss '' .","The song is a parody of the first official single from Slim Thug 's first album `` Already Platinum '' , also named `` Like a Boss '' ."
"Royal proclamations , local bylaws , market days , advertisements and even selling loaves of sugar were all proclaimed by a bellman or town crier for centuries .","Proclamations , local bylaws , market days , adverts , were all proclaimed by a bellman or crier ."
They had extensive oversee trade contacts with the Roman and Greek empires later on .,They had extensive maritime trade contacts with the Roman empire .
It is currently being produced by Beam Suntory .,The brand is now produced by Beam Suntory .
Bland moved to Meridian to run a State Farm Insurance Agency .,Bland came to Meridian to own and operate a State Farm Insurance Agency .
"They became important during the Industrial Revolution , when many worked in factories and mines .","Strikes became common during the Industrial Revolution , when mass labour became important in factories and mines ."
"After the war he returned to Charterhouse , resigning in 1921 to take part in the first Everest expedition .","After the war , Mallory returned to Charterhouse , resigning in 1921 in order to join the first Everest expedition ."
"He has attended management studies courses at Harvard University , although he did not receive a degree from this institution .",He has attended management studies courses at Harvard University .
"After handling a record 9.6 million passengers in 2008 , passenger numbers declined to 8,572,398 in 2010 , making Birmingham the seventh busiest UK airport .","Birmingham handled over 10.1 million passengers in 2015 , a record total for the airport making it the seventh busiest UK airport ."
"Aviacsa stopped all operations for good on May 4 , 2011 .","Aviacsa ceased operations on May 4 , 2011 ."
Krombacher Brauerei is one of the largest private owned breweries in Germany and the 2nd best selling German beer .,Krombacher Brauerei ( ) is one of the largest privately owned breweries in Germany and ranks number 2 among Germany 's best selling breweries .
"Over the years , many large companies have helped pay for the festival , such as Childress Vineyards , Pepsi , BB & T , Walmart , and other corporations .","Over the years , sponsors have included Childress Vineyards , Pepsi , BB & T , Walmart , and other large and local corporations ."
98 % of the US soybean crop is used for feeding farm animals .,98 % of the US soybean crop goes for livestock feed .
"He was appointed in 2010 and used to be a partner of in the law firm of Dickinson , Cruickshank & Co from 1985 - 2010 .",He was appointed in 2010 and was formerly a partner of Dickinson Cruickshank & Co from 1985 onwards .
"Protests at the proposed Royal Dutch Shell Corrib gas refinery in Kilcommon parish , Erris , County Mayo have seen a large Garda operation at its construction sites with up to 200 Gardaí involved , making it the single biggest policing operation in the country at times .","Protests at the proposed Royal Dutch Shell Corrib gas refinery near Erris , County Mayo saw large Garda operations with up to 200 Gardaí involved ."
"At Moa , there is a huge cobalt processing plant with shipping facilities , that was constructed with the help of foreign aid , much of it from Canada .","A large cobalt processing plant with shipping facilities was built at Moa , using foreign investment , much of it from Canada ."
"Molotov cocktails were eventually mass-produced by the Finnish military , bundled with matches to light them .","Molotov cocktails were eventually mass-produced by the Alko corporation at its Rajamäki distillery , bundled with matches to light them ."
"After his contract with Hanna-Barbera finished up he went to work with former co-worker Fred Seibert on `` Oh , Yeah ! Cartoons '' .","After his contract with Hanna-Barbera expired , he went to work with Seibert on the `` Oh Yeah !"
"Encyclopædia Britannica , Inc. is an American company known for publishing the `` Encyclopædia Britannica '' , the world 's oldest encyclopedia , and also the second largest .","Encyclopædia Britannica , Inc. is a Scottish-founded , now American company best known for publishing the `` Encyclopædia Britannica '' , the world 's oldest continuously published encyclopedia ."
"It started in 1948 as a non-profit trade organization The BCA headquarters is in Broomfield , Colorado .","The BCA is headquartered in Broomfield , Colorado ."
"Concord became a city on February 5 , 1905 .","Concord was incorporated on February 5 , 1905 ."
"He and his companions went out four square miles east of Denver , but the town and Colorado were not doing well after the Silver Crash of 1893 .","He and his partners staked out four square miles east of Denver , but the town - and Colorado - struggled mightily after the Silver Crash of 1893 ."
A sawmill is a place where lumber is cut into boards .,A sawmill is a facility where logs are cut into lumber .
"In an earlier approach , some fast food outlets dispense ketchup from pumps into paper cups .","Previously , fast food outlets dispensed ketchup from pumps into paper cups ."
"The 442nd Regimental Combat Team motto was , `` Go for Broke '' .",Its motto was `` Go for Broke '' .
"After graduating from Astronaut High School in 1993 and later the University of Central Florida with a degree in marketing , Tosh moved to Los Angeles where he lives with his dog .","After graduating from Astronaut High School in 1993 , Tosh attended the University of Central Florida , graduating in December 1996 with a degree in marketing ."
"In 2011 , the city had five corporations named to the U.S. Fortune 500 list including Nationwide Mutual Insurance Company , American Electric Power , Limited Brands , Momentive Specialty Chemicals , and Big Lots .","In 2013 , the city had four corporations named to the U.S. Fortune 500 list : Nationwide Mutual Insurance Company , American Electric Power , L Brands , and Big Lots , with Cardinal Health located in suburban Dublin ."
"He ran his laboratory like a military unit , and he was the one in command He terminated every subordinate who did not measure up to his standards .",He terminated every subordinate who did not measure up to his standards .
"In the 1990s , he published articles and books about software and computer networks ; these books were in German , but he also wrote articles in English .","In the 1990s , Ebner published articles and books on software and networking topics ; while these books were written in German , he also wrote some articles in English ."
