"As well as its coffee , tea , hot chocolate , and doughnuts , the Tim Hortons menu now includes a number of other baked goods , such as Timbits ( small balls of doughnut dough ) , muffins , croissants , tea biscuits , cookies , rolls , danishes , and bagels ( which Tim Hortons now sells one out of every two bagels in the whole Canadian food industry ) .","Aside from its coffee , tea , hot chocolate , and doughnuts , the Tim Hortons menu now contains a number of other baked goods , such as doughnut holes ( branded as Timbits ) , muffins , croissants , tea biscuits , cookies , rolls , danishes , and bagels – of which Tim Hortons sells one out of every two in the Canadian food service industry ."
"Since the mid-1990s , the chain has moved into other areas , such as flavoured cappuccino , iced cappuccino , iced coffee , New York-style cheesecake , and lunch items such as soup , chili , and submarine sandwiches .","Since the mid-1990s , the chain has moved into other areas , including specialty and premium items such as flavoured cappuccino , iced cappuccino , iced coffee , New York-style cheesecake , and a lunch selection that includes soups , chili , and submarine-style sandwiches ."
"Unbeknownst to the Dodgers , Robinson had already agreed with the president of Chock full o'Nuts to quit baseball and become an executive with the company .","The trade , however , was never completed ; unbeknownst to the Dodgers , Robinson had already agreed with the president of Chock full o'Nuts to quit baseball and become an executive with the company ."
The later construction of a new bridge over the Mississippi in the early 1980s replaced the remaining businesses .,The later construction of the current Sartell Bridge over the Mississippi in the early 1980s replaced the remaining businesses .
The first radial tire design and built by Firestone was the Firestone 500 Radial .,The first radial tire developed and produced by Firestone was the ill-fated Firestone 500 Radial .
"Ocala is well known as the horse capital of the world , one of only five cities ( four in the USA and one in France ) allowed under Chamber of Commerce guidelines to use this title based on yearly money produced by the horse industry .","Ocala is one of only five cities ( four in the USA and one in France ) permitted under Chamber of Commerce guidelines to use this title , based on annual revenue produced by the horse industry ."
"When Hooper had financial problems , the `` Britannica '' was managed by Sears Roebuck for about 18 years ( 1920–1923 , 1928–1943 ) .","When Hooper fell into financial difficulties , the `` Britannica '' was managed by Sears Roebuck for 18 years ( 1920–23 , 1928–43 ) ."
"A trade secret is a formula , practice , process , design , instrument , pattern , or a collection of information which is not generally known , invented or created , by which a business can obtain an economic advantage over competitors or customers .","A trade secret is a formula , practice , process , design , instrument , pattern , commercial method , or compilation of information which is not generally known or reasonably ascertainable by others , and by which a business can obtain an economic advantage over competitors or customers ."
"Lastly , rubber plantations were started in the early 20th century .",Large-scale rubber plantations began in the early 20th century .
"Aerospace engineer graduate from `` École nationale de l'aviation civile '' ( the French civil aviation university ; promotion 1963 ) and economist graduate from `` ENSAE ParisTech '' ( promotion 1973 ) , Hamza Ben Driss Ottmani hold boarder positions in the Moroccan public administration .","Aerospace engineer graduate from `` École nationale de l'aviation civile '' ( the French civil aviation university ; promotion 1963 ) and economist graduate from `` ENSAE ParisTech '' ( promotion 1973 ) , Ottmani hold boarder positions in the Moroccan public administration , particularly in the Ministries of Public Works and Transport ."
"Cooper Tires is the second largest United States based tire company , after Goodyear .","Cooper is the second largest U.S.-based tire company , after Goodyear ."
Debate over the future of the economy provided the background for Soviet leaders to take more power in the years after Lenin 's death in 1924 .,Debate over the future of the economy provided the background for a power struggle in the years after Lenin 's death in 1924 .
"It was patented by Perkin , who the next year opened a dyeworks mass-producing it at Greenford on the banks of the Grand Union Canal in London .","Suitable as a dye of silk and other textiles , it was patented by Perkin , who the next year opened a dyeworks mass-producing it at Greenford on the banks of the Grand Union Canal in London ."
"After service , he married , settled in Yad Eliyahu in Tel Aviv and began business industry and entrepreneurship .","After service , he married , settled in Yad Eliyahu in Tel Aviv , and opened a business ."
It has 330 departments covering one million square feet ( ) of retail space .,The store occupies a site and has 330 departments covering one million square feet ( ) of retail space .
"In 1964 , he helped start , with Harlem businessman Dunbar McLaurin , Freedom National Bank – an African-American-owned and operated bank based in Harlem .","In 1964 , he helped found , with Harlem businessman Dunbar McLaurin , Freedom National Bank—a black-owned and operated commercial bank based in Harlem ."
It was the sale of the Plumpe site in 1974 helped the club avoid bankruptcy,The sale of the site in 1971 helped the club avoid bankruptcy .
"Ruston was an industrial equipment manufacturer in Lincoln , England , the company 's history going back to 1840 .","Ruston & Hornsby , later known as Ruston , was an industrial equipment manufacturer in Lincoln , England , the company 's history going back to 1840 ."
"The British Rail Class 20 , also known as an English Electric Type 1 , is a class of diesel electric locomotive .","The British Rail ( BR ) Class 20 , otherwise known as an English Electric Type 1 , is a class of diesel-electric locomotive ."
"Enfield Lock was the main station for the Royal Small Arms Factory until it was closed in the late 1980s , and now it is used by the large housing development on the site known as Enfield Island Village and the Innova Science and Business park .","Enfield Lock was the main station for the Royal Small Arms Factory until its closure in the late 1980s , and now serves the large housing development on the site known as Enfield Island Village , as well as the nearby Innova Science and Business park ."
"William Randolph Cosentini ( June 12 , 1911 - January 28 , 1954 ) was an American mechanical engineer and businessman .","William Randolph Cosentini ( June 12 , 1911 – January 28 , 1954 ) was an American mechanical engineer and entrepreneur who founded Cosentini Associates ."
"Bizzar is the sixth studio album by American Horrorcore band , Insane Clown Posse and is the second half of `` Bizaar '' .",Bizzar is the seventh studio album by Insane Clown Posse .
He was the managing director of the Australian Broadcasting Corporation ( ABC ) from 1995 to 2000 .,"From 1995 to 2000 , he was managing director of the Australian Broadcasting Corporation ( ABC ) ."
"Organizations that opposed the bill include the : U.S. Chamber of Commerce , Eagle Forum , Society for Human Resource Management , National Association of Manufacturers , American Bakers Association , College and University Professional Association for Human Resources , Associated Builders and Contractors , and American Housing & Lodging Association .","U.S. Chamber of Commerce , Eagle Forum , Society for Human Resource Management , National Association of Manufacturers , American Bakers Association , College and University Professional Association for Human Resources , Associated Builders and Contractors , and American Hotel & Lodging Association ."
"First , a beta version of Windows codenamed `` Blackcomb '' was planned as the successor to Windows XP and Windows Server 2003 .","Originally , a version of Windows codenamed `` Blackcomb '' was planned as the successor to Windows XP and Windows Server 2003 in 2000 ."
"The Directorate consists of a Director-General and five directors in the areas of `` Operations '' , `` Human Resources '' , `` Resources and Operational Support '' , `` Communication '' , and `` International Law and Cooperation within the Movement '' .","The Directorate consists of a Director-General and five directors in the areas of `` Operations '' , `` Human Resources '' , `` Financial Resources and Logistics `` , `` Communication and Information Management '' , and `` International Law and Cooperation within the Movement '' ."
"Surrounding the wharfs was a large commercial district , light industrial businesses , and one of the city’s most notable neighborhoods .","Surrounding the wharfs was an extensive commercial district , light industrial businesses , and one of the city’s most significant neighborhood communities ."
"When the airline industry was deregulated in 1978 , Delta 's hub and spoke system was used by several airlines .","When the airline industry was deregulated in 1978 , Delta 's hub and spoke paradigm was annexed by several airlines ."
"Vernon Carver Rudolph ( June 30 , 1915 , Marshall County , Kentucky - August 16 , 1973 ) was the founder of Krispy Kreme Doughnuts , Inc .","Vernon Carver Rudolph ( June 30 , 1915 - August 16 , 1973 ) was the founder of Krispy Kreme Doughnuts , Inc.."
"The company is in Oberndorf in the state of Baden-Württemberg , but also has locations in the United Kingdom , France and the United States .","The company is located in Oberndorf in the state of Baden-Württemberg , and also has subsidiaries in the United Kingdom , France and the United States ."
Ron Hornbaker came up the idea for what is now known as BookCrossing in March 2001 .,Ron Hornbaker conceived the idea for what is now known as BookCrossing in late March 2001 .
Part of Oracle Corporation 's early success came from using the C programming language to install its products .,Part of Oracle Corporation 's early success arose from using the C programming language to implement its products .
In later years Schwerin von Krosigk wrote several books about economics policy and two versions of his memoirs .,"In later years , Schwerin von Krosigk wrote several books on economic policy and two versions of his memoirs ."
"On September 3 , 2014 , Tampa Bay Lightning owner Jeff Vinik announced that the arena would be renamed Amalie Arena after they came to an agreement with Amalie Oil Company , an oil company based in Tampa .","On September 3 , 2014 , Lightning owner Jeff Vinik announced the renaming of the Forum to Amalie Arena after coming to an agreement with Amalie Oil Company , an oil company based in Tampa ."
"It is sometimes abbreviated cu m , m3 , m^3 or m**3 when superscript characters or markup are not available/accessible ( i.e .","It is sometimes abbreviated to cu m , m3 , M3 , m^3 , m**3 , CBM , cbm when superscript characters or markup can not be used ( e.g ."
The American Council of Life Insurers reported that 75 % of the Fortune 500 companies provide some level of training to help their workers overcome this situation .,The American Council of Life Insurers reported that 75 % of the Fortune 500 companies provide some level of remedial training for their workers .
"The United States Department of Labor is a Cabinet department of the United States government responsible for occupational safety , wage and hour standards , unemployment insurance benefits , re-employment services , and some economic statistics .","The United States Department of Labor ( DOL ) is a cabinet-level department of the U.S. federal government responsible for occupational safety , wage and hour standards , unemployment insurance benefits , reemployment services , and some economic statistics ; many U.S. states also have such departments ."
"Gradually the partners began to actually make more and more of the parts , and by 1795 they purchased a property about a mile away from the Soho manufactory , on the banks of the Birmingham Canal .","Gradually the partners began to actually manufacture more and more of the parts , and by 1795 they purchased a property about a mile away from the Soho manufactory , on the banks of the Birmingham Canal , to establish a new foundry for the manufacture of the engines ."
"Mr. Wilson partnered with Wallace E. Johnson to build the first four motels on roads entering Memphis , Tennessee .",Wilson partnered with Wallace E. Johnson to build additional motels on the roads entering Memphis .
An even larger terminal to be built nearby is also being planned .,An even larger terminal to be sited nearby is also being promoted .
"As of December 2013 , the company provided approximately 12.7 billion records and had 2.14 million paying subscribers .","As of June 2014 , the company provided access to approximately 16 billion historical records and had over 2 million paying subscribers ."
"The British Rail Class 317 electric multiple units were built by BREL at York Works in two batches , from 1981-82 and 1985-87 .","The British Rail Class 317 alternating current electric multiple units ( EMUs ) were built by BREL York in two batches , from 1981–82 and 1985-87 ."
"Over 520 stores are arranged along three levels of pedestrian walkways on the sides of the rectangle , with a fourth level on the East side .","More than 530 stores are arranged along three levels of pedestrian walkways on the sides of the rectangle , with a fourth level on the east side ."
"In October 1981 , he started to work as bureau chief and was a close collaborator of Federal Finance Minister Hans Matthöfer and his successor Manfred Lahnstein .",From October 1981 he served as bureau chief and was a close collaborator of Federal Finance Minister Hans Matthöfer and his successor Manfred Lahnstein .
Fortunately the other 800 workers are expected to be recalled when car sales increase .,The other 800 workers are expected to be recalled when ( if ever ) car sales increase .
The GCV is part of the `` Follow On Incremental Capabilities Package '' of the BCT Modernization program .,The GCV was organized under the `` Follow On Incremental Capabilities Package '' of the BCT Modernization program .
Twenty-four of these 5-car units were built between 1988-89 by BREL at their Derby works .,Twenty-four of these 5-car units were built in 1988/89 by BREL at its Derby works .
"Then , in 2011 , Hospira , the only American company that made sodium thiopental , stopped making the drug .","Hospira , the only U.S. manufacturer of sodium thiopental , stopped making the drug in 2011 ."
The Kupferhof Bauschenberg was a brass producing factory built in the 17th century in the German city of Stolberg .,Kupferhof Bauschenberg was one of many brass producing factories built in the 17th century in the German city of Stolberg .
Bert is a French commune that is in the Allier department in the center of France .,Bert is a commune in the Allier department in central France .
"Between the three of them , they had enough money and political influence to control public business .",The three of them had enough money and political influence to control public business .
The Banco Anglo–Costarricense was established in 1864 and issued notes from 1864 to 1917 .,The Banco de Costa Rica was established in 1890 and issued notes from 1890 to 1914 .
The Banco de Costa Rica was established in 1890 and issued notes from 1890 to 1914 .,The Banco Anglo–Costarricense was established in 1864 and issued notes from 1864 to 1917 .
Mohamed Atta sat in business class with Abdulaziz al-Omari and Suqami .,Mohamed Atta sat in business class seat 8D with Abdulaziz al-Omari in 8G and Suqami in 10B .
"Although modified and modernised since , India remains influential over Bhutan 's foreign policy , defence and commerce .","India remains influential over Bhutan 's foreign policy , defence and commerce ."
"Cole essentially blamed Microsoft , `` This is related to XP SP3 , '' he stated .",Cole blamed Microsoft `` This is related to XP SP3 . ''
"Between 1911 and 1913 , he worked for his uncle in the office of the Branch coal mines in West Virginia .","Between 1911 and 1913 , he was employed by his uncle in the office of the Branch coal mines in West Virginia ."
Soft-paste factories were established at Chantilly in 1730 and at Mennecy in 1750 .,Soft-paste factories were established with the Chantilly manufactory in 1730 and at Mennecy in 1750 .
The US National Hot Dog and Sausage Council asserts that Frankfurt am Main is traditionally credited with originating the Frankfurter .,The National Hot Dog and Sausage Council asserts that Frankfurt is traditionally credited with originating the frankfurter .
"Among the earliest issues of paper rupees were those by the `` Bank of Hindustan '' ( 1770–1832 ) , the `` General Bank of Bengal and Bihar '' ( 1773–75 , established by Warren Hastings ) and the `` Bengal Bank '' ( 1784–91 ) , amongst others .","Among the earliest issues of paper rupees include ; the `` Bank of Hindustan '' ( 1770–1832 ) , the `` General Bank of Bengal and Bihar '' ( 1773–75 , established by Warren Hastings ) , and the `` Bengal Bank '' ( 1784–91 ) ."
Manufacturing of the new tire was done on equipment designed to build bias-ply tires .,Manufacturing of the new tire was performed on equipment designed to manufacture bias-ply tires .
2 operated by Abellio Greater Anglia,"Operated by Abellio Greater Anglia ,"
"The city has a diverse economy based on education , government , insurance , banking , fashion , defense , aviation , food , clothes , logistics , steel , energy , medical research , health care , hospitality , retail , and technology .","Columbus has a generally strong and diverse economy based on education , insurance , banking , fashion , defense , aviation , food , logistics , steel , energy , medical research , health care , hospitality , retail , and technology ."
Southampton Corporation bought the Southampton Electric Light and Power Company in 1896 .,"In 1896 , Southampton Corporation had bought out the Southampton Electric Light and Power Company ."
Prosperity ( wealth ) has always returned ( come back ) and will again . '',Prosperity has always returned and will again . ''
"Through this process , a private company transforms into a public company .","Through this process , a privately held company transforms into a public company ."
"Revenue ( or revenues ) is income that a company receives from its normal business activities , usually from the sale of goods and services to customers .","In business , revenue is the income that a business has from its normal business activities , usually from the sale of goods and services to customers ."
"Tokyopop has its headquarters in Los Angeles , California and branches in the United Kingdom and Germany .","TOKYOPOP had its US headquarters in the Variety Building in Los Angeles , California , and branches in the United Kingdom and Germany ."
The new carriers being built with only two flight deck elevators and new firefighting equipment .,The new carriers being built were redesigned to incorporate only two flight deck elevators and new firefighting equipment .
"Planet Plastics of Chino , California , the original company which made the bubble top , was asked to create a replacement .","Planet Plastics of Chino , California , the original company contracted to create the bubble top , was contracted to create a replacement ."
"He worked as an orthopedic surgeon , and later as the manager of a saw mill and glass factory .",He made his living as an orthopedic surgeon and later as the manager of a saw mill and glass factory .
"Allianz sold Dresdner Bank , which was legally merged with Commerzbank on 11 May 2009 and ceased to be an independent company .",Dresdner Bank was legally merged with Commerzbank on 11 May 2009 and ceased to be an independent entity .
The club is owned and sponsored by the mining company Dempo .,The club is owned and sponsored by the Dempo group of companies .
"The corporate headquarters are in Enterprise , Nevada , a suburb of Las Vegas .","The corporate headquarters are in Summerlin , Nevada , a suburban neighborhood in Las Vegas ."
"The company was also a partly-owned subsidiary of International Data Group ( IDG ) , a technology media , events and research company .","The company was also a part subsidiary of the privately held International Data Group ( IDG ) , a media , events and research technology group ."
"BWEs built since the 1990s , such as the Bagger 293 , have reached sizes as large as 96 metres ( 314.9 feet ) tall , 225 metres ( 738.2 feet ) long , and as heavy as 14,200 metric tons ( 31.3 million lb ) .","BWEs built since the 1990s , such as the Bagger 293 , have reached sizes as large as tall , long , and as heavy as ."
"As he got older , he began to help in the general store that his father owned .","As he grew older , Vernon Rudolph began to help in the general store that his uncle owned ."
Sorai also saw problems with the merchant class at the time : he accused them of conspiring to lock prices .,"He also saw problems with the merchant class at the time , which he accused of conspiring to fix prices ."
"Shell Oil Company , including its related companies , is one of the US’s largest oil and natural gas producers , natural gas marketers , gasoline marketers and petrochemical manufacturers .","Shell Oil Company , including its consolidated companies and its share in equity companies , is one of America 's largest oil and natural gas producers , natural gas marketers , gasoline marketers and petrochemical manufacturers ."
"The very first saloon was created in Brown 's Hole , Wyoming , in 1822 and served fur trappers .","The first saloon was established at Brown 's Hole , Wyoming , in 1822 , to serve fur trappers ."
"A & C Black bought both Christopher Helm Publishers and later the Pica Press , which are publishers of the Helm Identification Guides , written by Christopher Helm .","A & C Black purchased both Christopher Helm Publishers and later the Pica Press , publishers of the Helm Identification Guides , from Christopher Helm ."
The Delaware Department of Transportation is responsible for taking care of the numbered roads in Delaware .,The Delaware Department of Transportation is responsible for maintaining numbered roads in Delaware .
"The divisions are Boeing Commercial Airplanes ( BCA ) ; Boeing Defense , Space & Security ( BDS ) ; Engineering , Operations & Technology ; Boeing Capital ; and Boeing Shared Services Group .","Boeing is organized into five primary divisions : Boeing Commercial Airplanes ( BCA ) ; Boeing Defense , Space & Security ( BDS ) ; Engineering , Operations & Technology ; Boeing Capital ; and Boeing Shared Services Group ."
"His elder brother , Thomas Lombe took over the business .","John 's elder brother , Thomas , took over the business ."
"Companies implement specialized IM archiving and security products and services like those from Secure Computing , Akonix , Surfcontrol , and ScanSafe to mitigate these risks and provide safe , secure , productive instant messaging capabilities to their employees .","Companies implement specialized IM archiving and security products and services to mitigate these risks and provide safe , secure , productive instant messaging abilities to their employees ."
The Panamanian economy has been one of the fastest growing and best managed in Latin America .,Panama 's economy has been among the fastest growing and best managed in Latin America .
Bromsgrove train station is in the south of the town .,Bromsgrove railway station is situated to the south of the town .
"While the Commission agreed that he had suffered undue and unreasonable prejudice and disadvantage , it dismissed the occurrence as a casual incident brought about by the bad judgment of an employee .","While the Commission acknowledged that he had been subjected to undue and unreasonable prejudice and disadvantage , it dismissed the occurrence as a casual incident brought about by the bad judgment of an employee and refused to enter an order as to future practices ."
"In economics , productive efficiency is a situation in which an economy is not able to produce any more of one good without reducing the production of another good .",Productive efficiency is a situation in which the economy could not produce any more of one good without sacrificing production of another good .
One catalyst was the recovery of the British economy after post-World War II hard times had lasted through much of the 1950s .,One catalyst was the recovery of the British economy after post-World War II austerity which lasted through much of the 1950s .
A venture capital fund is a pooled investment vehicle ( often a limited partnership ) that primarily invests the financial capital of third-party investors in enterprises that are too risky for the standard capital markets or bank loans .,"A venture capital fund refers to a pooled investment vehicle ( in the United States , often an LP or LLC ) that primarily invests the financial capital of third-party investors in enterprises that are too risky for the standard capital markets or bank loans ."
To earn extra money he designed labels for fruit jellies and jams .,"To earn extra money , he designed labels for jams and preserves ."
This set up a single industrial relations bureaucracy called Fair Work Australia .,This established a single industrial relations bureaucracy called Fair Work Australia .
"Most of the Sprouses ' franchise ended in 2008 , except for their clothing line .","The majority of the Sprouses ' franchise ended in 2008 , except for their clothing line ."
