He also founded the independent country music record label BNA Records which he later sold to BMG Music .,Castleman founded the independent country music record label BNA Records which he later sold to BMG Music .
Workers at a Ford plant in Sichuan were evacuated for about 10 minutes .,"Meanwhile , workers at a Ford plant in Sichuan were evacuated for about 10 minutes ."
The airport is under one of the strictest ordinances in the United States on both airport noise and the number of commercial flights .,The airport is under one of the strictest ordinances in the United States on airport noise and the number of airline flights .
"This all happened during the middle of the great depression , so they moved to Nashville , Tennessee to see if they could get better business there and secure their financial future .","This all occurred during the middle of the Great Depression , so they moved to Nashville , Tennessee to see if they could get better business there and secure their financial future ."
The problems were particularly noticeable during events popular with the technology industry such as the 2008 Macworld Conference & Expo keynote address .,The downtime was particularly noticeable during events popular with the technology industry such as the 2008 Macworld Conference & Expo keynote address .
His most famous achievement was the successful introduction of tea from China to India in 1848 on behalf of the British East India Company .,His most famous accomplishment was the successful transportation of tea from China to India in 1848 on behalf of the British East India Company .
"The contract was signed in May 1994 , with the major technology supplier being the ERG Group .","The contract was signed in May 1994 , with the major technology supplier being the ERG Group ( now Vix Technology ) ."
"Starting as a Collector of Customs for the Gold Coast , he later became the Treasurer of the Gold Coast and The Gambia .","Starting as a Collector of Customs for the Gold Coast , he then became a Treasurer of the Gold Coast and the Gambia ."
"Tim Chaney , the former Managing Director was named as President .","Tim Chaney , the former Managing Director was named president ."
"However , with increased air activity by commercial airlines and the private airplane industry , particularly with Douglas Aircraft showing an interest in the Long Beach Municipal Airport , the facility required more space .","With increased activity by commercial airlines and the private airplane industry , particularly with Douglas Aircraft showing an interest in the Long Beach Municipal Airport , the facility needed more space ."
"Turbostar is the name given to a series of diesel multiple units ( DMU ) built by Bombardier Transportation ( previously ADtranz ) at their Litchurch Lane Works in Derby , England .","Turbostar is the name given to a family of diesel multiple units ( DMUs ) built by Bombardier Transportation ( previously ADtranz ) at their Litchurch Lane Works in Derby , England ."
"Arthur Murray ( born Moses Teichman , April 4 , 1895 – March 3 , 1991 ) was an American dance instructor and businessman , whose name is most often associated with the dance studio chain which bears his name .","Arthur Murray ( April 4 , 1895 – March 3 , 1991 ) was an American dance instructor and businessman , whose name is most often associated with the dance studio chain that bears his name ."
`` Camellia sinensis '' is of major commercial importance because tea is made from its leaves .,"`` Camellia sinensis '' , the tea plant , is of major commercial importance because tea is made from its leaves ."
( 7 ) `` There is no truth in the Bible ; it is only monkey business .,`` < br > < br > ( 7 ) `` There is no truth in the Bible ; it is only monkey business .
Trustees who wikt '' violate this duty are self-dealing .,Trustees who violate this fiduciary duty are self-dealing .
The goal is to become a `` zoo tycoon '' .,The player 's goal is to become a `` zoo tycoon '' .
The operation is currently contracted to MTR Corporation .,The operation is contracted to MTR Corporation .
The record label went bankrupt shortly thereafter .,The label went bankrupt shortly thereafter .
The constituency is now restricted to only 144 insurers .,The constituency is restricted to only 144 insurers .
"The community was named after Reuben Branson , postmaster and operator of a general store in the area in the 1880s .","The community was named after Ruben Branson , postmaster and operator of a general store in the area in the 1880s ."
"The bill is long , thin , and sharply hooked .","The bill is long , thin and hooked ."
"The Tribune Tower is a neo-Gothic building located at 435 North Michigan Avenue in Chicago , Illinois , USA .","The Tribune Tower is a neo-Gothic structure located at 435 North Michigan Avenue in Chicago , Illinois , USA ."
The Fieschi were a noble family of Liguria .,The Fieschi were a noble merchant family of Liguria .
"The Clunes Miners ' Association is one of the earliest beginnings of the Construction , Forestry , Mining and Energy Union .","The Clunes Miners ' Association is one of the earliest antecedents of the Construction , Forestry , Mining and Energy Union ."
The Board had seven members and a staff .,The Board had seven members and a large staff .
"Since then , it has been owned by the Imanpa Development Association , and managed by their company Lisanote Pty .","Since 1994 , it has been owned by the Imanpa Development Association Inc. , and managed by their company Lisanote Pty ."
Shiga has agreements with three states .,Shiga has cooperative agreements with three states .
Schultz 's wife Nancy and du Pont 's head of security were present and witnessed the crime .,Schultz 's wife Nancy and du Pont 's head of security Patrick Goodale were present and witnessed the crime .
Repco is an Australian engineering company .,Repco is an Australian automotive engineering company .
Publicly traded companies often have more working capitalThey can also delegate debt throughout all shareholders .,Publicly traded companies often have more working capital and can delegate debt throughout all shareholders .
Names shown in bold means the airport has scheduled passenger service on commercial airlines .,Names shown in bold indicate the airport has scheduled passenger service on commercial airlines .
"It was the joint production of Davey Paxman & Co , Shell Refining & Marketing Co and Lt-Col L.F.R .","It was the joint production of Davey Paxman & Co , Shell Refining & Marketing Co and Lt-Col L. F .R ."
"Firestone was more than a billion dollars in debt at the time , and losing 250 million dollars a year .","It was more than a billion dollars in debt at the time , and losing 250 million dollars a year ."
Byzantion was mainly a trading city due to its strategic location at the Black Sea 's only entrance .,It was mainly a trading city due to its location at the Black Sea 's only entrance .
"Irmo was chartered on Christmas Eve in 1890 because of the opening of the Columbia , Newberry , and Laurens Railroad .","Irmo was chartered on Christmas Eve in 1890 in response to the opening of the Columbia , Newberry and Laurens Railroad ."
"In talks with investors of the movie , they presented an eight-minute documentary along with newspapers and news footage .","In talks with investors , they presented an eight-minute documentary along with newspapers and news footage ."
"In some other countries , a Treasury will co-exist with a separate Ministry of Finance , with divided functions .","In some other countries , a `` Treasury '' will exist alongside a separate `` Ministry of Finance '' , with divided functions ."
"In February 2011 , Fenty became an outside adviser to Rosetta Stone , which produces foreign language software .","In February 2011 , Fenty became an outside adviser to Rosetta Stone , which produces foreign-language software ."
"In December 1994 , the two boutiques began to suffer .","In December 1994 , the boutiques began to suffer ."
"His brother , Ronald , is a lawyer and economist .","His older brother , Ronald , is a lawyer and economist ."
"Tobin 's academic work included pioneering contributions to the study of investment , monetary and fiscal policy and financial markets .","His academic work included pioneering contributions to the study of investment , monetary and fiscal policy and financial markets ."
He was admitted to the Ohio bar in 1860 .,He was admitted to the bar in 1861 .
He is the chairman of Soros Fund Management .,He is chairman of Soros Fund Management .
"He calls himself a `` pimp '' , which he says stands for `` Player In the Management P '' 'rofession . ''","He calls himself a `` pimp '' , which he says stands for `` Player In the Management Profession . ''"
"During the First World War , the London branch was forced to close ; however , the overall branch network expanded .","During the First World War , the London branch was forced to close ; however , the branch network itself expanded ."
"Despite the popular topic of the song , Forbes ended in last place and received only two points .","Despite the popular topic of the song , Forbes ended in 18th and last place and mustered only two points ."
"David Bruce `` Dave '' Goldberg ( October 2 , 1967 – May 1 , 2015 ) was an American businessman .","David Bruce `` Dave '' Goldberg ( October 2 , 1967 – May 1 , 2015 ) was an American management consultant and businessman ."
Burg-Reuland is a municipality in the Belgian province of Liège .,Burg-Reuland is a municipality located in the Belgian province of Liège .
"Because the effect derives from changes to the `` Real Balance '' , this is also called the Real Balance effect .","Because the effect derives from changes to the `` Real Balance '' , this critique of Keynesianism is also called the Real Balance effect ."
B & N 's critics claim that it has added to the decline of local and independent booksellers .,B & N 's critics claim that it has contributed to the decline of local and independent booksellers .
"KA-BAR is the trademark and namesake of a related knife manufacturing company , KA-BAR Knives. , Inc. ( formerly Union Cutlery Co. ) of Olean , New York .","Additionally , KA-BAR is the trademark and namesake of a related knife manufacturing company , KA-BAR Knives. , Inc. ( formerly Union Cutlery Co. ) of Olean , New York , a subsidiary of the Cutco Corporation ."
"Construction of this facility is underway , with the first manufacturing line expected to be fully operational this year .","Construction of this facility was underway , with the first manufacturing line expected to be fully operational in 2009 ."
This lead to Batista 's departure from the stable .,This led to Batista 's departure from the stable .
"Its main office is based in Canary Wharf , London , with another office in Edinburgh .","Its main office was in Canary Wharf , London , with another office in Edinburgh ."
"Gerardo Andrés Sofovich ( March 18 , 1937 – March 8 , 2015 ) was an Argentine businessman , dramaturge , TV host , actor , comedian , scriptwriter , and film director .","Gerardo Andrés Sofovich ( March 18 , 1937 – March 8 , 2015 ) was an Argentine businessman , dramaturge , television host and presenter , comedian , scriptwriter , and director ."
This brought commerce and industry to the area .,This brought commerce and industry to the region .
"In 1785 , Titsingh was appointed Director of the VOC trading post at Chinsura in Bengal .","In 1785 , Titsingh was appointed director of the trading post at Chinsura in Bengal ."
"According to the Springfield Convention & Visitors Bureau , an estimated three million overnight visitors and millions of day-trippers visit the city annually .","According to the Springfield Convention & Visitors Bureau , an estimated 3,000,000 overnight visitors and day-trippers annually visit the city ."
"Controversy surrounded Metcard at its introduction , due to it costing to much , the abolition of tram conductors and the unreliability of ticket purchasing and validation machines .","Controversy surrounded Metcard at its introduction , due to cost over-runs , the abolition of tram conductors and the unreliability of ticket purchasing and validation machines ."
"Trees were knocked down , and business signs were blown down .","Trees were downed , and business signs were blown down ."
"This store carries a large variety of textbooks , medical books , and medical supplies in addition to the various trade titles carried at the company 's main stores .","This flagship store carried a large variety of textbooks , medical and legal books , and medical supplies , in addition to the various trade titles carried at the company 's main stores ."
The term `` security clearance '' is also sometimes used in private organizations that have a formal process of selecting employees to access `` sensitive information '' .,The term `` security clearance '' is also sometimes used in private organizations that have a formal process to vet employees for access to sensitive information .
"It has the headquarters of the Eastern Caribbean Central Bank , as well as the Eastern Caribbean Securities Exchange , which lists securities for companies and corporations in the region .","It is home to the headquarters of the Eastern Caribbean Central Bank , as well as the Eastern Caribbean Securities Exchange , which lists securities for companies and corporations in the region ."
"The period after the Liberal Wars allowed the economy to flourish , and the port of Ponta Delgada expanded , through the export of new crops such as tea , pineapple , and tobacco .","Following the Liberal Wars , the period of Devourism allowed the economy to flourish , and the port of Ponta Delgada expanded , through the export of new crops such as tea , pineapple , and tobacco ."
Most Mandriva Linux developers who were laid off went to Mageia .,Most developers who were laid off went to Mageia .
"Sean , Liadan 's brother and heir to Sevenwaters , wants to buy the Painted Man 's fighting men in their long battle for the sacred islands .","Sean , Liadan 's brother and heir to Sevenwaters , wants to purchase the Painted Man 's fighting force in their long battle for the sacred islands ."
"They are much more interested in forward looking and taking decisions that will affect the future of the organization , than in the historical recording and compliance ( score keeping ) aspects of the profession .","They are more concerned with forward looking and taking decisions that will affect the future of the organization , than in the historical recording and compliance ( score keeping ) aspects of the profession ."
The French also had a fur trading post at the village .,The French also had a fur trading post in the village .
"This idea originated in the mainframe market where online transaction processing emphasized not just the execution speed of one transaction , but the capacity to deal with big numbers of transactions at the same time .","This idea originated in the mainframe market where online transaction processing emphasized not just the execution speed of one transaction , but the capacity to deal with massive numbers of transactions ."
The place where a baker works is called a bakehouse or a bakery .,The place where a baker works is called a bakery .
Hagerstown is also the chief commercial and industrial hub for a greater Tri-State Area that includes much of Western Maryland as well as great extents of South Central Pennsylvania and the Eastern Panhandle of West Virginia .,Hagerstown is also the chief commercial and industrial hub for a greater Tri-State Area that includes much of Western Maryland as well as significant portions of South Central Pennsylvania and the Eastern Panhandle of West Virginia .
"Tourism was , and continues to be one of the more important economic enterprises for the municipality .","Tourism has been , and continues to be one of the more important economic enterprises for the municipality ."
"Students also have the opportunity to attend a technical and managerial course sanctioned by a Master of Business Administration in `` business and international negotiation '' of the `` Institut supérieur de gestion '' in addition to the diploma of the university , or to make the last year of studies in a foreign university in partnership with IPSA .","Students also have the opportunity to attend a technical and managerial course sanctioned by an MBA in `` business and international negotiation '' of the `` Institut supérieur de gestion '' in addition to the diploma of the school , or to make the last year of studies in a foreign university in partnership with IPSA ."
"After the war , the British North Borneo Company returned to administer Jesselton but was unable to finance the huge costs of reconstruction .","After the war on the edge of bankruptcy , the British North Borneo Company returned to administer Jesselton but was unable to finance the huge costs of reconstruction ."
"Among products produced in Chojnów are : paperware , agricultural machinery , chains , metal furniture for hospitals , equipment for the meat industry , beer , wine , leather clothing , clothing for infants , children and adults .","Among local products are : paper , agricultural machinery , chains , metal furniture for hospitals , equipment for the meat industry , beer , wine , leather clothing , and clothing for infants , children and adults ."
The Mozilla project has traditionally been overseen by a committee known as mozilla.org staff ; the individuals on that committee later became foundation or corporation board members or staff members .,The Mozilla project has traditionally been overseen by a committee known as mozilla.org staff ; some individuals on that committee later became Foundation or Corporation board members or employees .
The company was founded in October 2007 .,The Company was founded in October 2007 .
"Because of the increased demand and the restrictions on exports of the metals from China , some countries are stockpiling rare earth resources .","As a result of the increased demand and tightening restrictions on exports of the metals from China , some countries are stockpiling rare earth resources ."
"The anticipated work for this class was yard shunting , trip work ( between local yards ) and short distance freight trains .",The anticipated work for this class was trip working movements between local yards and short distance freight trains .
An airline hub is an airport that an airline uses as a transfer point to get passengers to their intended destination .,Airline hubs are airports that an airline uses as a transfer point to get passengers to their intended destination .
"Some examples include : convenience stores , other small shops ( such as a bakery ) , hairdressers , tradesmen , lawyers , accountants , restaurants , guest houses , photographers , small-scale manufacturing , and online business , such as web design and programming .","Typical examples include : convenience stores , other small shops ( such as a bakery or delicatessen ) , hairdressers , tradesmen , lawyers , accountants , restaurants , guest houses , photographers , small-scale manufacturing , and online businesses , such as web design and programming ."
"In 1994 , Konzum joined the Agrokor group .",Konzum joined the Agrokor group in 1994 .
The rules on industrial action has become regarded almost as general legal principles of conflicts between the labor market forces .,The rules on industrial action has come to be regarded almost as general legal principles of conflicts between the labor market forces .
"The mustard manufacturer 's original factory was next to the stadium in Carrow Road , and the ground was opened by Russell Colman , the President of the club .","The mustard manufacturer 's original factory was located adjacent to the stadium in Carrow Road , and the ground was opened by Russell Colman , the President of the club ."
"In the early 1950s , The Amazing Criswell predicted on national television that Paul Marco would go far in the movie business .","In the early 1950s , The Amazing Criswell predicted on national television that Paul Marco would go far in the motion picture business ."
"In 2002 , head packer Steve Peters chose a painting of himself by Dave Machin as a possible winner for the Packing Room Prize .","In 2002 , head packer Steve Peters singled out a painting of himself by Dave Machin as a possible winner for the Packing Room Prize ."
"Mainly known for shunting engines for the British market , but also built main line engines for overseas customers .","They mainly built shunting engines for the British market , but also built main line engines for overseas customers ."
Traditional Standard Costing must comply with generally accepted accounting principles ( GAAP US ) and actually aligns itself more with answering Financial Accounting requirements rather than providing solutions for management accountants .,Traditional standard costing must comply with generally accepted accounting principles ( GAAP US ) and actually aligns itself more with answering financial accounting requirements rather than providing solutions for management accountants .
Johnson Wax Headquarters is the world headquarters and administration building of S. C. Johnson & Son .,"Johnson Wax Headquarters is the world headquarters and administration building of S. C. Johnson & Son in Racine , Wisconsin ."
Robinson accepted a contract for $ 400 ( $ in 2016 dollars ) per month .,Robinson accepted a contract for $ 400 per month .
"TAG Group ( Holdings ) SA is a private holding company based in Luxembourg City , in southern Luxembourg .","TAG Group ( Holdings ) S.A. is a private holding company based in Luxembourg City , Luxembourg ."
"The airport is a base for Ryanair , and also charter airlines Bmibaby , Flybe , Monarch , Thomas Cook Airlines and Thomson Airways .","The airport is a base for Flybe , Monarch , Ryanair , Thomas Cook Airlines and Thomson Airways ."
Tyrrell then signed a deal to run Formula 2 cars made by French company Matra .,Tyrrell then signed a deal to run Formula Two cars made by French company Matra .
"Though customers can not try fitting the products , they are willing to buy them .","Though customers can not try the products on , they are willing to buy them ."
"They were built in the late 1980s and early 1990s by BREL , which later became ABB .",They were built in the late 1980s and early 1990s by BREL ( which became part of ABB in the 1990s ) .
"These women received pay in coin , home industries , alcohol , baked goods , and other valuables .","These women received `` tuition '' in coin , home industries , alcohol , baked goods , and other valuables ."
The handwriting and style is unlike that of the `` Dear Boss '' letter and postcard .,The handwriting and style is unlike that of the `` Dear Boss '' letter and `` Saucy Jacky '' postcard .
"The first digital advertisers included : Calvin Klein , Apple Computer , Toyota and Nike .","The first digital advertisers included Calvin Klein , Apple Computer , Stephen Colbert , Toyota and Nike ."
The buffalo hunting industry became an important employer of Aboriginal people during the dry-season months .,The buffalo-hunting industry became an important employer of Aboriginal people during the dry-season months .
"The airport has a flight training school with two classrooms , fuel facilities and a seafood shop .","The airport has a flight training school with two classrooms , fuel facilities and a seafood outlet ."
"Since its introduction in 1994 , over 80 million Foreman grills have been sold .","Since its introduction in 1994 , over 100 million George Foreman grills have been sold worldwide ."
"John Paul Getty II asked his father for the money , but was refused .","John Paul Getty Jr. asked his father for the money , but was refused ."
"It opened in 1966 , founded by Bengt Erlandson , more commonly known as 'Big Bengt ' .","It opened in 1966 and was founded by Bengt Erlandson , more commonly known as Big Bengt ."
"In a typical year , approximately half of the food it purchased from a local supplier came from out-of-state .","In a typical year , approximately half of the food it purchased from a local supplier originated out-of-state ."
"In September 2010 , Coach 15 visited the L & B with the `` Lew '' replica engine , `` Lyd '' .","In September 2010 , Coach 15 visited the L & B with the `` Lew '' replica loco , `` Lyd '' ."
"In 1938 , the BBWAA raised the amount of voters to three per city and gave 14 points for a first-place vote .","In 1938 , the BBWAA raised the number of voters to three per city and gave 14 points for a first-place vote ."
"In 1849 Nathaniel Cook registered a chess set design , and Jaques of London got the manufacturing rights .","In 1849 Nathaniel Cook registered a chess set design , and Jaques of London obtained the manufacturing rights ."
"For other institutions , issuing of debt contracts such as bonds is a main source of funding .","For other institutions , issuing of debt contracts such as bonds is a typical source of funding ."
Even the name of the controlling body changed in 1988 - from Norfolk Port and Industrial Authority to Norfolk Airport Authority .,Even the name of the supervising body changed in 1988 – from Norfolk Port and Industrial Authority to Norfolk Airport Authority .
Colombia signed a Free Trade Agreement with the United States to the opposition of Venezuela .,Colombia signed a Free Trade Agreement with the United States against opposition by Venezuela .
"By 1917 , Farrell was the Dairy and Food Commissioner of Minnesota and president of the National Creamery Buttermakers ' Association .",By 1917 he was the Dairy and Food Commissioner of Minnesota and president of the National Creamery Buttermakers ' Association .
